种子、苗木及其它繁殖材料、烟叶、粮谷、豆类（入境前须事先办理检疫审批手续）；,ー、禁止随身携带但可以作为行李托运的物品,旅客帮乘机人代取寄存在安检的物品，如果旅客没有乘机人的身份证，寄存单遗失。如果旅客可以提供乘机人乘机日期，航班号码，物品名称和数量，及旅客的身份证，安检工作人员可以找到该物品，旅客可以领取到该寄存物品,68.化肥的运输规定：化肥属于违禁品，既不能随身携带也不可以托运。,59.枪状的电钻不超过托运行李的尺寸可以托运。
送机的无陪儿童家长一般要求留在机场，直到飞机起飞才可以离开。若小孩已过安检，或者已经登机，航班延误时间较长还未起飞，家长担心小孩状况的情况下，可以让家长拨打84797373咨询。如果是南航航班，可以到A岛问询柜台咨询工作人，或者咨询84799333。,航班飞机关舱门后至起飞前，或者降落后至开舱门前，旅客在航空器内等待，超过机场规定的地面滑行时间，就算是“机上延误”。,机场始发的机场大巴从T2始发，经停T1，行驶时间约5分钟；市内大巴到达机场后皆先停靠T2，最后开至T1。,1、航班起飞前40分钟开始登机，航班起飞前15分钟停止登机，开始登机时机场中央大广播会自动播放登机广播，主要是催促已经办理值机手续但还未过安检的旅客尽快过安检，开始登机后登机口也会有相应区域广播，主要是航班动态、登机口变更以及催促旅客登机广播，该广播覆盖范围有限，若旅客离开登机口则有可能听不到。若旅客来电质疑没有听到广播通知，中央大广播记录可联系广播室查询，登机口区域广播可联系候机查询，但广播录音均不可对外。,发生延误后，航空公司要在30分钟内告知旅客航班延误或者取消信息。发生机上延误时，要每30分钟向机上旅客通报动态信息，机上延误超过2小时（含）的，应当为机上旅客提供饮用水和食品。超过3小时的，要在安全允许的情况下，安排旅客下飞机等待。
1、不论航班是否正常，自助值机柜台办理值机手续的时间均为航班原计划起飞前的两小时开始办理，起飞前的五十分钟截止办理。,国际航班值机：柜台是分不同的航空公司开放，200坐以下的飞机起飞前2小时开始办理值机手续，200以上提前3小时开始办理值机手续，提前40分钟结束办理，亚航国际航班提前一小时截止办理登机牌。,国内值机时间：值机柜台是全开放式，所有旅客可以在航班起飞前3小时开始办理值机手续，起飞前40分钟停止办理。,从长沙机场出发的国际航班，只要旅客已经向航司成功申请了行李加重，在办理值机的时候就可以享受已经加重后的托运行李额。,5、办理值机手续时，出示该电子身份证给值机员目测即可
42.血液一般要求托运，建议带上医院证明，方便安检检查。如果一定要带上飞机，必须要有市级或以上的医院的证明，需要证明血液来源的合法性和血液的无传染性。,乘坐飞机前的安检环节可能曾给很多旅客带来过困扰，尤其是在旅客身体有残疾或者携带贵重物品的情况下。因为通常情况下，安检场所是公开场所，这就意味着旅客的个人隐私可能无法得道妥善的保护。,●  对于携带高仿的奢侈品出境，如果只是旅客自己穿戴或使用是不做限制的，但是如果是盈利性质或者数量较多，海关根据国家保护法有责任对此进行处罚的。,外国人用护照购买国内航段的机票，护照名字按中国人的习惯姓在前名在后，买票时名在前姓在后，例如：护照是ZHOU MARK，订票时用的MARK  ZHOU，安检值机都没影响，不会影响乘机。,如果旅客需要办理宠物托运（跟航班走）必须要有由正规的检验检疫单位开具的动物检疫证明与消毒证明（一般宠物医院开具的无效），旅客如果有湖南省宠物免疫证也是无法办理宠物托运的。建议旅客先要咨询好办证点是否是正规单位，最后就是购票同时向航司确认，乘坐的航班是否是有氧舱，航司是否同意办理宠物托运。
用护照买票持身份证过检，旅客可以提供护照复印件或护照照片，与旅客的身份证一起进行比对核实后放行。,2、自助值机柜台只能刷二代身份证办理登机手续，若用其他有效证件购票，须手动输入相应有效证件的号码。自助值机终端无法办理有绑定婴儿旅客的其他旅客的登机牌。,台胞证过期，让旅客携带过期的证件和新台胞证领取的回执单，在有效期内可以乘坐国内的航班。,5、办理值机手续时，出示该电子身份证给值机员目测即可,g.如果儿童未上户，公安在系统中查询不到其户籍信息，凭出生证明等证件也无法开具临时乘机证明。12周岁以下儿童乘机可以凭户口本，出生证明原件或者复印件。
送机的无陪儿童家长一般要求留在机场，直到飞机起飞才可以离开。若小孩已过安检，或者已经登机，航班延误时间较长还未起飞，家长担心小孩状况的情况下，可以让家长拨打84797373咨询。如果是南航航班，可以到A岛问询柜台咨询工作人，或者咨询84799333。,如出租车司机的行驶证在机场被扣留，须在机场执法大队缴纳罚款，可以联系 84799498 （行政班），地址在机场篮球场附近。,c.	旅客在机场登机牌遗失，在该航班规定值机时间内可以在机场相应开放的柜台进行补打登机牌，不限在国内值机主任柜台。如果旅客的登机牌为航空公司官网通过网上值机打印，也是同样规定。,4.旅客在机场控制区、航空器内购买或者取得的液态物品在离开机场控制区之前可以随身携带。,93.国内航班不超过行李尺寸的植物可以带上飞机，也可以进行托运，有根茎或者土壤的也可以。
送机的无陪儿童家长一般要求留在机场，直到飞机起飞才可以离开。若小孩已过安检，或者已经登机，航班延误时间较长还未起飞，家长担心小孩状况的情况下，可以让家长拨打84797373咨询。如果是南航航班，可以到A岛问询柜台咨询工作人，或者咨询84799333。,26.国内航班可携带不超过随身行李重量的水果(榴莲除外)上飞机，国际航班不允许携带水果登机；如果旅客需要托运榴莲，需要向相关航空公司确认，机场这边安检一般没有问题。,以往，无论是天气状况、空中交通管制，还是机场和航空公司方面的原因，面对航班延误或取消，旅客听到的往往是航空公司或者机场单方面给出的理由，至于是不是和实际情况相符合，旅客通常也无从知晓。,1、航班起飞前40分钟开始登机，航班起飞前15分钟停止登机，开始登机时机场中央大广播会自动播放登机广播，主要是催促已经办理值机手续但还未过安检的旅客尽快过安检，开始登机后登机口也会有相应区域广播，主要是航班动态、登机口变更以及催促旅客登机广播，该广播覆盖范围有限，若旅客离开登机口则有可能听不到。若旅客来电质疑没有听到广播通知，中央大广播记录可联系广播室查询，登机口区域广播可联系候机查询，但广播录音均不可对外。,OPO工作人员预计不能及时到达机场，应当主动通过航空公司客服电话向其说明情况，由航空公司启动应急预案。在飞机起飞前到达机场的，由航空公司协调开通人体捐献器官绿色通道，快速办理登机手续、优先通过安检登机。在飞机起飞后到达机场的，由航空公司负责协调安排改签临近航班。航班延误时，除天气因素等不可抗力外，由航空公司协调承运人体捐献器官的航班优先起飞，尽量缩短人体捐献器官运输时间。遇航班满员，在捐献器官保存期限内无其他适宜航班，经协调OPO人员仍无法乘机的，经航空公司同意，可委托机组人员携带转运器官，必要时可通过航空货运运输，航空公司不承担人体捐献器官保管责任。
民航部门负责保障运送人体捐献器官的人员优先安检、快速登机、协调承运人体捐献器官的航班班次，遇拥堵或流量控制时优先放行。,国内外发生重大传染病疫情时，由国家质检总局发布对出入境交通工具和人员及其携带物采取临时性检验检疫强制措施的公告，来自疫区的交通工具必须在指定的地点停靠；出入境人员必须逐人如实填报《出入境检疫健康申明卡》，并由检验检疫专用通道通行；出入境人员携带物必须逐件通过X光机透视检查。,OPO工作人员在明确获取人体捐献器官时间后，根据实际需要，航空运输时应当将航班班次通过航空公司客服电话直接向其通报。通关时，OPO工作人员应当携带移植中心器官接受确认书，人体捐献器官运输箱应当在箱外显著位置张贴人体器官运输专用标志。检察人员认为有必要的，可拨打国家卫生计生委人体捐献器官转运绿色通道24小时应急电话查验相关信息，并留存移植中心器官接受确认书副本。人体捐献器官运输箱应当接受X射线行李安全仪器设备的检查，无疑点的可不再进行开箱检查。器官运输箱内含有航空部门禁止或限制携带物品的，应当事先取得航空公司、铁路部门的同意；含有保存人体捐献器官所必须的业态物品的，不受液态物品航空运输条件的限制，但均应满足存储和运输安全要求。,收运政府限制运输以及需经公安、工商、动植物检疫等政府有关部门许可运输的货物，托运人应提供上述部门出具的有效证明文件。,在机场办理手续时，旅客需要提供医疗部门在规定时限内出具的适宜乘机“诊断证明书”“特殊旅客乘机申请书”；担架旅客如果需要使用地面设备（如救护车、升降机等），该费用由旅客自行承担。
OPO工作人员在明确获取人体捐献器官时间后，根据实际需要，航空运输时应当将航班班次通过航空公司客服电话直接向其通报。通关时，OPO工作人员应当携带移植中心器官接受确认书，人体捐献器官运输箱应当在箱外显著位置张贴人体器官运输专用标志。检察人员认为有必要的，可拨打国家卫生计生委人体捐献器官转运绿色通道24小时应急电话查验相关信息，并留存移植中心器官接受确认书副本。人体捐献器官运输箱应当接受X射线行李安全仪器设备的检查，无疑点的可不再进行开箱检查。器官运输箱内含有航空部门禁止或限制携带物品的，应当事先取得航空公司、铁路部门的同意；含有保存人体捐献器官所必须的业态物品的，不受液态物品航空运输条件的限制，但均应满足存储和运输安全要求。,人体捐献器官转运绿色通道是指人体器官获取组织（以下简称OPO）获取人体捐献器官后，为缩短器官运输时间，在保障安全的前提下采取的快速、有序的人体捐献器官转运措施。,民航部门负责保障运送人体捐献器官的人员优先安检、快速登机、协调承运人体捐献器官的航班班次，遇拥堵或流量控制时优先放行。,OPO工作人员预计不能及时到达机场，应当主动通过航空公司客服电话向其说明情况，由航空公司启动应急预案。在飞机起飞前到达机场的，由航空公司协调开通人体捐献器官绿色通道，快速办理登机手续、优先通过安检登机。在飞机起飞后到达机场的，由航空公司负责协调安排改签临近航班。航班延误时，除天气因素等不可抗力外，由航空公司协调承运人体捐献器官的航班优先起飞，尽量缩短人体捐献器官运输时间。遇航班满员，在捐献器官保存期限内无其他适宜航班，经协调OPO人员仍无法乘机的，经航空公司同意，可委托机组人员携带转运器官，必要时可通过航空货运运输，航空公司不承担人体捐献器官保管责任。,安检门和检查设备都是符合国家安全标准的，旅客可以放心接受检查；它通过感应寄生电流及均化磁场的数字信号处理方式获得很高的分辨，但发射磁场厚度很低，对心脏起搏器佩带者、孕妇、体弱者、磁性媒质（U盘、信用卡等）和其他电子装置均无害，广大旅客通过安全门时尽可放心接受检查；如果孕妇旅客仍然担心安检仪器的辐射，可以现场申请手动检查。
去台湾必须出具往返程机票。如回程不直接回长沙，也要出具离开台湾去其他地方的行程单·,1、登录国家质检总局网站（http://www.aqsiq.gov.cn/）“卫生检疫”专栏，或者登录湖南出入境检验检疫局网站（http://www.hnciq.gov.cn/）“保健中心”专栏进行查询；,不要着急，这一点民航局显然也考虑到了：,《规定》不仅明确了超过“15分钟”就算是延误，还明确了什么是“离港”，什么算是“到港”，飞机在机场滑行也算时间。,外国人用护照购买国内航段的机票，护照名字按中国人的习惯姓在前名在后，买票时名在前姓在后，例如：护照是ZHOU MARK，订票时用的MARK  ZHOU，安检值机都没影响，不会影响乘机。
注：1.因黑屏里查询不到9C的机票价格，如果旅客乘坐9C航班，要咨询全价票及逾重行李额，请让旅客直接联系航司。,无陪儿童服务一般需要旅客购买无陪儿童机票且向相应航司申请无陪儿童服务。没有任何证件的无陪儿童买机票与航空公司营业部联系，如果买到UM票。可以办理无陪。旅客可凭无陪申请单到机场联系84797373办理相关手续；如果是南航航班，可以到A岛问询柜台咨询工作人，或者咨询84799333。,长沙黄花国际机场停车场为您提供专属车位贵宾服务。服务内容：贵宾专属停车位、广告发布、代客泊车、贵宾通道、代办值机服务。另外贵宾同时可享受合作商铺贵宾折扣等多项增值服务。为了方便车主快速通行，免去零钱烦扰，提供充值卡服务。 营销客服、车位预订电话：18890014753,7. 海航货运只能提海航航班的货物，海航下属航空公司（如祥鹏航空等）在机场货运提货。海航货运因为属于海航自己管理，如果旅客投诉，可以告知旅客拨打海航货运值班手机，或者直接向海航服务热线投诉。,送机的无陪儿童家长一般要求留在机场，直到飞机起飞才可以离开。若小孩已过安检，或者已经登机，航班延误时间较长还未起飞，家长担心小孩状况的情况下，可以让家长拨打84797373咨询。如果是南航航班，可以到A岛问询柜台咨询工作人，或者咨询84799333。
去台湾必须出具往返程机票。如回程不直接回长沙，也要出具离开台湾去其他地方的行程单·,b. 超大超限行李尺寸标准，宽*高不能超过1m*1m，长度只要可以放上传送带即可。是否需要收费建议咨询航司，由航司工作人员现场收取。不建议告知旅客有超大超限行李通道。超大超限的安检上下班的时间是随航班走。,“微信值机” 开放时间与航空公司网上值机时间相同，若旅客反映官网已经可以值机了，但是我们微信不行。微信值机数据会在晚上8点更新，可建议旅客晚上8点以后再试。若还是不行可能是航司并未开放该航班权限。,送机的无陪儿童家长一般要求留在机场，直到飞机起飞才可以离开。若小孩已过安检，或者已经登机，航班延误时间较长还未起飞，家长担心小孩状况的情况下，可以让家长拨打84797373咨询。如果是南航航班，可以到A岛问询柜台咨询工作人，或者咨询84799333。,外国人用护照购买国内航段的机票，护照名字按中国人的习惯姓在前名在后，买票时名在前姓在后，例如：护照是ZHOU MARK，订票时用的MARK  ZHOU，安检值机都没影响，不会影响乘机。
老年旅客乘机首先要确认老人身体健康状况是否适应乘机，身体健康的老人有人陪同即可，建议带上医生诊断证明。如果老人身体健康状况欠佳或者无人陪同，建议旅客提前向航司申请，经航司同意后机场才能提供相应的服务。,小孩出生满了14天，身体健康就可以乘机。,42.血液一般要求托运，建议带上医院证明，方便安检检查。如果一定要带上飞机，必须要有市级或以上的医院的证明，需要证明血液来源的合法性和血液的无传染性。,送机的无陪儿童家长一般要求留在机场，直到飞机起飞才可以离开。若小孩已过安检，或者已经登机，航班延误时间较长还未起飞，家长担心小孩状况的情况下，可以让家长拨打84797373咨询。如果是南航航班，可以到A岛问询柜台咨询工作人，或者咨询84799333。,h.12岁以下儿童或婴儿无法提供任何纸质证明，家人也不清楚孩子的任何证件号码，如果已经上户且为湖南省内户口，机场公安办可以根据父母的信息调取孩子的信息，如查实真实有效，可以开具临时登机证明。
身体装有假肢或因手术原因体内有金属的旅客，建议咨询医生的专业意见，如果医生诊断适宜乘机即可凭相关手术证明乘机。不方便拿到手术证明的旅客也可以申请在现场进行检查。其他原因不方便现场进行检查的，可以向现场安检的工作人员申请到单独的小房间里进行检查。,安检门和检查设备都是符合国家安全标准的，旅客可以放心接受检查；它通过感应寄生电流及均化磁场的数字信号处理方式获得很高的分辨，但发射磁场厚度很低，对心脏起搏器佩带者、孕妇、体弱者、磁性媒质（U盘、信用卡等）和其他电子装置均无害，广大旅客通过安全门时尽可放心接受检查；如果孕妇旅客仍然担心安检仪器的辐射，可以现场申请手动检查。,46.氯化钠液体一般不允许携带，如果一定要带，必须办理托运。旅客可提前到现场，安检会用仪器进行检查。如果旅客提供医院相关证明（盖公章），可免开瓶检查,而《规定》指出，2017年1月1日起，如有旅客携带贵重物品、旅客植入心脏起搏器或身患残疾等情况，旅客本人可要求在非公开场所进行安检。此时，将由两名以上与旅客同性别的安检员对旅客进行安检。,乘坐飞机前的安检环节可能曾给很多旅客带来过困扰，尤其是在旅客身体有残疾或者携带贵重物品的情况下。因为通常情况下，安检场所是公开场所，这就意味着旅客的个人隐私可能无法得道妥善的保护。
长沙黄花国际机场停车场为您提供专属车位贵宾服务。服务内容：贵宾专属停车位、广告发布、代客泊车、贵宾通道、代办值机服务。另外贵宾同时可享受合作商铺贵宾折扣等多项增值服务。为了方便车主快速通行，免去零钱烦扰，提供充值卡服务。 营销客服、车位预订电话：18890014753,长沙机场出港海航航班的折扣头等舱不享受地面贵宾服务，机上可以享受同等服务；其他航空公司的折扣与正价头等舱均享受同等的机上和地面贵宾服务。,商务贵宾厅停车场主要针对商务贵宾旅客车辆临时停放，不能过夜。停放免费，但是必须要提前预约。政务贵宾厅停车场不对外开放，主要是省委领导等领导使用，停放免费。,一、要客服务部门接到有重要旅客的通知后，应事先准备好贵宾休息室，并备妥供应物品。,关于贵宾厅的现金服务的旅客，每个厅收费标准不同，若有需求可直接联系乐翔分公司营销部。隔离区外的送机服务只送到安检口，不送到登机口。
机场高速：过机场高速收费站后右转可看到机场货运的指示牌，沿路直走再左拐即到新货站；,如果旅客使用护照购买了国内转国际的联程机票，可以建议旅客请原售票点在国内段备注身份证号码；如无法备注可以使用护照复印件和身份证从长沙机场乘机前往转机地。,c.	旅客在机场登机牌遗失，在该航班规定值机时间内可以在机场相应开放的柜台进行补打登机牌，不限在国内值机主任柜台。如果旅客的登机牌为航空公司官网通过网上值机打印，也是同样规定。,机场始发的机场大巴从T2始发，经停T1，行驶时间约5分钟；市内大巴到达机场后皆先停靠T2，最后开至T1。,长沙黄花国际机场巴士时刻表
2、旅客质疑登机口无工作人员，可告知旅客候机工作人员工作地点并不固定，可能目前还在其他登机口办理旅客登机服务，等旅客的航班快到登机时间工作人员会提前过来。若已经到登机时间还无工作人员可联系候机室确认。,送机的无陪儿童家长一般要求留在机场，直到飞机起飞才可以离开。若小孩已过安检，或者已经登机，航班延误时间较长还未起飞，家长担心小孩状况的情况下，可以让家长拨打84797373咨询。如果是南航航班，可以到A岛问询柜台咨询工作人，或者咨询84799333。,如果旅客要求取消值机，一般情况下旅客值机在哪办理就在哪取消。若旅客人在机场可提供乘机人身份证原件和登机牌到机场开放的值机柜台取消值机，若旅客已经离开机场，可告知旅客正常情况下24小时候会自动取消登机状态，若超过24小时仍未取消可记录旅客姓名证件号码以及航班信息由坐席员联系值机取消。,从长沙机场出发的国际航班，只要旅客已经向航司成功申请了行李加重，在办理值机的时候就可以享受已经加重后的托运行李额。,航班飞机关舱门后至起飞前，或者降落后至开舱门前，旅客在航空器内等待，超过机场规定的地面滑行时间，就算是“机上延误”。
旅客托运行李内部分物品丢失：目的地为长沙的航班，旅客未出机场隔离区可以建议旅客跟行李查询室联系，离开机场建议旅客联系公安机关报案处理；长沙始发的航班建议旅客联系到达机场。,从长沙机场出发的国际航班，只要旅客已经向航司成功申请了行李加重，在办理值机的时候就可以享受已经加重后的托运行李额。,旅客值机后航班延误需要取消行程办理退票，若旅客还在机场可到原值机柜台退回登机牌，再联系原售票处办理退票，若已经离开机场，可不退回登机牌，旅客客票状态会在飞机起飞后自动变回未使用，建议旅客次日再联系售票处办理退票，若旅客客票状态一直未值机状态不能退票，客服人员可记录旅客客票信息再联系值机取消。,1、航班起飞前40分钟开始登机，航班起飞前15分钟停止登机，开始登机时机场中央大广播会自动播放登机广播，主要是催促已经办理值机手续但还未过安检的旅客尽快过安检，开始登机后登机口也会有相应区域广播，主要是航班动态、登机口变更以及催促旅客登机广播，该广播覆盖范围有限，若旅客离开登机口则有可能听不到。若旅客来电质疑没有听到广播通知，中央大广播记录可联系广播室查询，登机口区域广播可联系候机查询，但广播录音均不可对外。,3、南航自助值机只要是过了零点就能办理当天的航班，没有起飞时间的限制，但存在部分航班无法自助打印的情况。
8. 南航航班到达一个小时后就可以开始提货，普货在工作时间提取，生鲜货物可以24小时提取，但如果时间较晚建议旅客需提前与南航货运联系。,从香港转机第三国的旅客，需要有有效护照和第三国有效签证可以在香港停留7天；如第三国为落地签，旅客凭有效护照和来回程的行程单也可乘机。,“微信值机” 开放时间与航空公司网上值机时间相同，若旅客反映官网已经可以值机了，但是我们微信不行。微信值机数据会在晚上8点更新，可建议旅客晚上8点以后再试。若还是不行可能是航司并未开放该航班权限。,“航班延误”，是指航班实际到港轮挡时间，晚于计划到港时间超过15分钟的情况；“航班出港延误”，是指航班实际出港撤轮挡时间，晚于计划出港时间超过15分钟的情况。,3、南航自助值机只要是过了零点就能办理当天的航班，没有起飞时间的限制，但存在部分航班无法自助打印的情况。
