乘坐飞机前的安检环节可能曾给很多旅客带来过困扰，尤其是在旅客身体有残疾或者携带贵重物品的情况下。因为通常情况下，安检场所是公开场所，这就意味着旅客的个人隐私可能无法得道妥善的保护。,七、在国务委员、副总理以上重要旅客乘坐的航班上，严禁押送犯人、精神病患者乘坐。售票处和值机部门要严格把关，并通知货运部门，严禁在该航班上装载危险物品。,预防接种当天及次日要安静，休息，避免受凉，多喝开水，应保护接种部位，避免劳累、碰撞及激烈运动，并询问医护人员注意的原则。,29. 用保温杯装好的口味虾只要包装完好没有液体（汤汁）可以带上飞机；,42.血液一般要求托运，建议带上医院证明，方便安检检查。如果一定要带上飞机，必须要有市级或以上的医院的证明，需要证明血液来源的合法性和血液的无传染性。
机场始发的机场大巴从T2始发，经停T1，行驶时间约5分钟；市内大巴到达机场后皆先停靠T2，最后开至T1。,长永高速：过长永高速收费站后直走到最南边看到机场货运的指示拍后左拐，沿路直走再左拐即到新货站；,机场高速：过机场高速收费站后右转可看到机场货运的指示牌，沿路直走再左拐即到新货站；,2、黄花机场可购买龙骧集团省内长途汽车票：自2017年1月1日起，旅客可在黄花机场到达层机场巴士售票柜台购买龙骧集团各大汽车站的长途汽车票，（包括汽车东站、汽车南站、汽车西站、黎托汽车站、长株潭汽车站、浏阳汽车站）。欢迎有需要的旅客前来咨询购买。详情请咨询0731-84798076。,4、汽车南站：原汽车南站已搬至新的过度站，新的具体地点：中意路与万芙路交汇处东北角，也可跟旅客描述为万芙路 湘中物流旁。站内机场巴士统一在大厅窗口买票，乘车在负一楼，原联系方式已停用，统一告知0731-84798076。
c.	旅客在机场登机牌遗失，在该航班规定值机时间内可以在机场相应开放的柜台进行补打登机牌，不限在国内值机主任柜台。如果旅客的登机牌为航空公司官网通过网上值机打印，也是同样规定。,旅客用台胞证拼音购买机票，登机牌只能是大陆版本拼英，请旅客在办值机的时候与值机说清楚情况请值机在登机牌上盖章，否则安检会阻拦。,如果旅客要求取消值机，一般情况下旅客值机在哪办理就在哪取消。若旅客人在机场可提供乘机人身份证原件和登机牌到机场开放的值机柜台取消值机，若旅客已经离开机场，可告知旅客正常情况下24小时候会自动取消登机状态，若超过24小时仍未取消可记录旅客姓名证件号码以及航班信息由坐席员联系值机取消。,护照丢失乘机要求：1、中国人丢失护照到当地公安局补办护照。2、外国人或者港澳同胞乘坐国内航班：丢失护照，到出入境管理局办理遗失证明。3、外国人乘坐国际航班：方式一：去大使馆补办护照；方式二：去当地出入境管理局咨询是否可以办理外国人出入境通行证。4、港澳台同胞乘坐地区航班：到当地出入境管理局办理证件。,旅客值机后航班延误需要取消行程办理退票，若旅客还在机场可到原值机柜台退回登机牌，再联系原售票处办理退票，若已经离开机场，可不退回登机牌，旅客客票状态会在飞机起飞后自动变回未使用，建议旅客次日再联系售票处办理退票，若旅客客票状态一直未值机状态不能退票，客服人员可记录旅客客票信息再联系值机取消。
目前各个航空公司（除国航、深航、厦航、河北航、山东航、西藏航外）针对70岁以上的老人乘机可以申请办理无陪老人服务（长沙始发海航航班不可办理无陪老人服务。但是如果旅客在现场柜台申请，年龄在70岁以上，工作人员确实觉得老人身体没有问题，情况比较特殊，柜台会酌情考虑。不建议告知旅客。）但根据各航空公司规定，部分航空公司会要求老年旅客签署“航空运输免责单”；如有其他特殊情况或要求，旅客可以直接与航空公司联系。,“微信值机” 开放时间与航空公司网上值机时间相同，若旅客反映官网已经可以值机了，但是我们微信不行。微信值机数据会在晚上8点更新，可建议旅客晚上8点以后再试。若还是不行可能是航司并未开放该航班权限。,1、目前，只实现了湖南省内公民的电子身份证在长沙黄花国际机场过安检，其他省份的会陆续开放。,无陪儿童服务一般需要旅客购买无陪儿童机票且向相应航司申请无陪儿童服务。没有任何证件的无陪儿童买机票与航空公司营业部联系，如果买到UM票。可以办理无陪。旅客可凭无陪申请单到机场联系84797373办理相关手续；如果是南航航班，可以到A岛问询柜台咨询工作人，或者咨询84799333。,外国人用护照购买国内航段的机票，护照名字按中国人的习惯姓在前名在后，买票时名在前姓在后，例如：护照是ZHOU MARK，订票时用的MARK  ZHOU，安检值机都没影响，不会影响乘机。
机场：T1、T2航站楼一楼到达层内，其他各起点站均有售票点,以往，无论是天气状况、空中交通管制，还是机场和航空公司方面的原因，面对航班延误或取消，旅客听到的往往是航空公司或者机场单方面给出的理由，至于是不是和实际情况相符合，旅客通常也无从知晓。,1、机场巴士站：位于长沙黄花国际机场T2航站楼到达层，在到达厅大内设有售票、咨询柜台和专用候车室，在到达大厅外设有15个班线发车站台。,2.厦航机场售票柜台（长沙黄花国际机场T2航站楼国内出发厅1号和2号门之间）,T2航站楼负二层员工停车场的启用，为航站楼工作的员工带来极大便利，从运行以来的实际情况看，每天夜间需进入该停车场的员工极少，基于安全考虑，现对T2航站楼负二层员工停车场开放时间进行调整：
以往，无论是天气状况、空中交通管制，还是机场和航空公司方面的原因，面对航班延误或取消，旅客听到的往往是航空公司或者机场单方面给出的理由，至于是不是和实际情况相符合，旅客通常也无从知晓。,目前各个航空公司（除国航、深航、厦航、河北航、山东航、西藏航外）针对70岁以上的老人乘机可以申请办理无陪老人服务（长沙始发海航航班不可办理无陪老人服务。但是如果旅客在现场柜台申请，年龄在70岁以上，工作人员确实觉得老人身体没有问题，情况比较特殊，柜台会酌情考虑。不建议告知旅客。）但根据各航空公司规定，部分航空公司会要求老年旅客签署“航空运输免责单”；如有其他特殊情况或要求，旅客可以直接与航空公司联系。,外国人用护照购买国内航段的机票，护照名字按中国人的习惯姓在前名在后，买票时名在前姓在后，例如：护照是ZHOU MARK，订票时用的MARK  ZHOU，安检值机都没影响，不会影响乘机。,26.国内航班可携带不超过随身行李重量的水果(榴莲除外)上飞机，国际航班不允许携带水果登机；如果旅客需要托运榴莲，需要向相关航空公司确认，机场这边安检一般没有问题。,1、航班起飞前40分钟开始登机，航班起飞前15分钟停止登机，开始登机时机场中央大广播会自动播放登机广播，主要是催促已经办理值机手续但还未过安检的旅客尽快过安检，开始登机后登机口也会有相应区域广播，主要是航班动态、登机口变更以及催促旅客登机广播，该广播覆盖范围有限，若旅客离开登机口则有可能听不到。若旅客来电质疑没有听到广播通知，中央大广播记录可联系广播室查询，登机口区域广播可联系候机查询，但广播录音均不可对外。
专属车位有60个，中银联客户如享1元停车优惠特权，只能将车停放于银联专属停车区域。如车位已满就不能享受银联高端停车优惠活动。详情咨询95516中国银联客户热线。)如客户是将车停放于银联专属停车区。出场时超过时间按照P1停车场收费标准补足超时部分即可，不能协商停放在P1其他普通车位。,备注：2018年2月14日凌晨起，实行30分钟免费停车场惠民优惠政策，超过30分钟免费时间的车辆按规定标准收费。对在4小时内两次进入停车场且第一次进入时按规定免收停车费的车辆，从第二次起不计免费时间，按规定收取停车费。,从2014年12月20日起，每日22:30至次日05:00，T2航站楼负二层员工停车场不接受车辆进入，车辆驶出不收影响（紧急情况时可拨打长沙黄花国际机场分公司保卫部综合监察大队值班电话：13874925119、64919）,黄花机场停车场设有两处车辆集中停放区域，分别为T1、T2航站楼停车场。（T1航站楼停车场于2018年5月16日重新启用）,1.国内航班早班飞机一般是从5：30开始办理值机，自助值机终端也是5：30开始才能使用。
无陪儿童服务一般需要旅客购买无陪儿童机票且向相应航司申请无陪儿童服务。没有任何证件的无陪儿童买机票与航空公司营业部联系，如果买到UM票。可以办理无陪。旅客可凭无陪申请单到机场联系84797373办理相关手续；如果是南航航班，可以到A岛问询柜台咨询工作人，或者咨询84799333。,d.旅客如果订当天的票，有可能出现值机时无机票信息的情况。出现这种情况的原因一般是因为订票信息没有及时从黑屏传送到值机系统的白屏。遇到这种情况，在确认黑屏中机票信息正常之后，可以提供票号给旅客，让值机人员从黑屏导入，或者建议旅客到值机主任柜台办理。,如果旅客使用护照购买了国内转国际的联程机票，可以建议旅客请原售票点在国内段备注身份证号码；如无法备注可以使用护照复印件和身份证从长沙机场乘机前往转机地。,外国人用护照购买国内航段的机票，护照名字按中国人的习惯姓在前名在后，买票时名在前姓在后，例如：护照是ZHOU MARK，订票时用的MARK  ZHOU，安检值机都没影响，不会影响乘机。,旅客用台胞证拼音购买机票，登机牌只能是大陆版本拼英，请旅客在办值机的时候与值机说清楚情况请值机在登机牌上盖章，否则安检会阻拦。
长沙黄花国际机场巴士时刻表,旅客托运行李内部分物品丢失：目的地为长沙的航班，旅客未出机场隔离区可以建议旅客跟行李查询室联系，离开机场建议旅客联系公安机关报案处理；长沙始发的航班建议旅客联系到达机场。,2.厦航机场售票柜台（长沙黄花国际机场T2航站楼国内出发厅1号和2号门之间）,2、长沙火车站（民航大酒店）：位于长沙市芙蓉区五一东路，紧邻长沙火车站、长株潭汽车站。机场巴士停靠民航大酒店院内。,机场新货站：
b.异地机场开具的，有标注有效期的临时乘机证明，在有效期内可以在长沙机场直接使用。,如出租车司机的行驶证在机场被扣留，须在机场执法大队缴纳罚款，可以联系 84799498 （行政班），地址在机场篮球场附近。,3、南航自助值机只要是过了零点就能办理当天的航班，没有起飞时间的限制，但存在部分航班无法自助打印的情况。,如果旅客需要办理宠物托运（跟航班走）必须要有由正规的检验检疫单位开具的动物检疫证明与消毒证明（一般宠物医院开具的无效），旅客如果有湖南省宠物免疫证也是无法办理宠物托运的。建议旅客先要咨询好办证点是否是正规单位，最后就是购票同时向航司确认，乘坐的航班是否是有氧舱，航司是否同意办理宠物托运。,d.旅客如果订当天的票，有可能出现值机时无机票信息的情况。出现这种情况的原因一般是因为订票信息没有及时从黑屏传送到值机系统的白屏。遇到这种情况，在确认黑屏中机票信息正常之后，可以提供票号给旅客，让值机人员从黑屏导入，或者建议旅客到值机主任柜台办理。
“微信值机” 开放时间与航空公司网上值机时间相同，若旅客反映官网已经可以值机了，但是我们微信不行。微信值机数据会在晚上8点更新，可建议旅客晚上8点以后再试。若还是不行可能是航司并未开放该航班权限。,3、南航自助值机只要是过了零点就能办理当天的航班，没有起飞时间的限制，但存在部分航班无法自助打印的情况。,外国人用护照购买国内航段的机票，护照名字按中国人的习惯姓在前名在后，买票时名在前姓在后，例如：护照是ZHOU MARK，订票时用的MARK  ZHOU，安检值机都没影响，不会影响乘机。,d.旅客如果订当天的票，有可能出现值机时无机票信息的情况。出现这种情况的原因一般是因为订票信息没有及时从黑屏传送到值机系统的白屏。遇到这种情况，在确认黑屏中机票信息正常之后，可以提供票号给旅客，让值机人员从黑屏导入，或者建议旅客到值机主任柜台办理。,目前各个航空公司（除国航、深航、厦航、河北航、山东航、西藏航外）针对70岁以上的老人乘机可以申请办理无陪老人服务（长沙始发海航航班不可办理无陪老人服务。但是如果旅客在现场柜台申请，年龄在70岁以上，工作人员确实觉得老人身体没有问题，情况比较特殊，柜台会酌情考虑。不建议告知旅客。）但根据各航空公司规定，部分航空公司会要求老年旅客签署“航空运输免责单”；如有其他特殊情况或要求，旅客可以直接与航空公司联系。
2、长沙火车站（民航大酒店）：位于长沙市芙蓉区五一东路，紧邻长沙火车站、长株潭汽车站。机场巴士停靠民航大酒店院内。,长沙黄花国际机场巴士时刻表,2.厦航机场售票柜台（长沙黄花国际机场T2航站楼国内出发厅1号和2号门之间）,9、株洲(绿园酒店)：位于株洲市芦淞区建设南路，紧邻株洲火车站、芦淞商业市场、金融大厦，中心广场。机场巴士停靠在株洲绿园宾馆民航售票处前方。,11、湘潭嘉园酒店售票处：位于湘潭市雨湖区韶山东路，紧邻基建营、湘潭市第4中学。机场巴士停靠在湘潭嘉园大酒店前坪。
2.厦航机场售票柜台（长沙黄花国际机场T2航站楼国内出发厅1号和2号门之间）,南航有两个贵宾厅:1.头等舱休息室，1-7号安检口右边; 2.金银卡旅客休息室，31号登机口旁边。建议旅客到A岛问讯处咨询,6号贵宾厅V6，T1航站楼2号门南侧,7号、8号、9号头等舱休息室，位于隔离区候机厅A岛附近；,2、黄花机场可购买龙骧集团省内长途汽车票：自2017年1月1日起，旅客可在黄花机场到达层机场巴士售票柜台购买龙骧集团各大汽车站的长途汽车票，（包括汽车东站、汽车南站、汽车西站、黎托汽车站、长株潭汽车站、浏阳汽车站）。欢迎有需要的旅客前来咨询购买。详情请咨询0731-84798076。
外国人用护照购买国内航段的机票，护照名字按中国人的习惯姓在前名在后，买票时名在前姓在后，例如：护照是ZHOU MARK，订票时用的MARK  ZHOU，安检值机都没影响，不会影响乘机。,如果香港旅客想从长沙出港到台湾，无论成人还是小孩都不可以用香港护照，必须用回乡卡（港澳居民来往内地通行证）才能从长沙出境。,3、南航自助值机只要是过了零点就能办理当天的航班，没有起飞时间的限制，但存在部分航班无法自助打印的情况。,乘坐飞机前的安检环节可能曾给很多旅客带来过困扰，尤其是在旅客身体有残疾或者携带贵重物品的情况下。因为通常情况下，安检场所是公开场所，这就意味着旅客的个人隐私可能无法得道妥善的保护。,如果旅客是长沙到香港的航班，持L签可以自由行出发。
以往，无论是天气状况、空中交通管制，还是机场和航空公司方面的原因，面对航班延误或取消，旅客听到的往往是航空公司或者机场单方面给出的理由，至于是不是和实际情况相符合，旅客通常也无从知晓。,送机的无陪儿童家长一般要求留在机场，直到飞机起飞才可以离开。若小孩已过安检，或者已经登机，航班延误时间较长还未起飞，家长担心小孩状况的情况下，可以让家长拨打84797373咨询。如果是南航航班，可以到A岛问询柜台咨询工作人，或者咨询84799333。,“微信值机” 开放时间与航空公司网上值机时间相同，若旅客反映官网已经可以值机了，但是我们微信不行。微信值机数据会在晚上8点更新，可建议旅客晚上8点以后再试。若还是不行可能是航司并未开放该航班权限。,旅客用台胞证拼音购买机票，登机牌只能是大陆版本拼英，请旅客在办值机的时候与值机说清楚情况请值机在登机牌上盖章，否则安检会阻拦。,如果旅客要求取消值机，一般情况下旅客值机在哪办理就在哪取消。若旅客人在机场可提供乘机人身份证原件和登机牌到机场开放的值机柜台取消值机，若旅客已经离开机场，可告知旅客正常情况下24小时候会自动取消登机状态，若超过24小时仍未取消可记录旅客姓名证件号码以及航班信息由坐席员联系值机取消。
1、机场巴士站：位于长沙黄花国际机场T2航站楼到达层，在到达厅大内设有售票、咨询柜台和专用候车室，在到达大厅外设有15个班线发车站台。,2.厦航机场售票柜台（长沙黄花国际机场T2航站楼国内出发厅1号和2号门之间）,机场：T1、T2航站楼一楼到达层内，其他各起点站均有售票点,机场高速：过机场高速收费站后右转可看到机场货运的指示牌，沿路直走再左拐即到新货站；,黄花机场停车场设有两处车辆集中停放区域，分别为T1、T2航站楼停车场。（T1航站楼停车场于2018年5月16日重新启用）
凭常旅客卡可进入头等舱休息室及免费行李额度：,长沙机场出港海航航班的折扣头等舱不享受地面贵宾服务，机上可以享受同等服务；其他航空公司的折扣与正价头等舱均享受同等的机上和地面贵宾服务。,机场南航贵宾厅内只提供南航航班信息广播，如旅客乘坐除南航以外的航班，持南航贵宾卡在贵宾厅休息，将会听不到航班信息，请提醒旅客。,除了海航的A舱和南航外的其他航空公司的折扣头等舱都可以享受地面贵宾厅服务。,如果旅客要求取消值机，一般情况下旅客值机在哪办理就在哪取消。若旅客人在机场可提供乘机人身份证原件和登机牌到机场开放的值机柜台取消值机，若旅客已经离开机场，可告知旅客正常情况下24小时候会自动取消登机状态，若超过24小时仍未取消可记录旅客姓名证件号码以及航班信息由坐席员联系值机取消。
8、广电：位于长沙市开福区三一大道上的湖南广播电视中心，紧邻湖南会展中心、世界之窗。机场巴士临时停靠广电会展中心公交站。,2、长沙火车站（民航大酒店）：位于长沙市芙蓉区五一东路，紧邻长沙火车站、长株潭汽车站。机场巴士停靠民航大酒店院内。,9、株洲(绿园酒店)：位于株洲市芦淞区建设南路，紧邻株洲火车站、芦淞商业市场、金融大厦，中心广场。机场巴士停靠在株洲绿园宾馆民航售票处前方。,长沙黄花国际机场巴士时刻表,2.厦航机场售票柜台（长沙黄花国际机场T2航站楼国内出发厅1号和2号门之间）
长沙黄花国际机场巴士时刻表,南航国际发货和提货电话均为84797562 ，地址在机场新货运站旁南航国际货运的办公室。,2.厦航机场售票柜台（长沙黄花国际机场T2航站楼国内出发厅1号和2号门之间）,机场新货站：,2、长沙火车站（民航大酒店）：位于长沙市芙蓉区五一东路，紧邻长沙火车站、长株潭汽车站。机场巴士停靠民航大酒店院内。
乘坐飞机前的安检环节可能曾给很多旅客带来过困扰，尤其是在旅客身体有残疾或者携带贵重物品的情况下。因为通常情况下，安检场所是公开场所，这就意味着旅客的个人隐私可能无法得道妥善的保护。,外国人用护照购买国内航段的机票，护照名字按中国人的习惯姓在前名在后，买票时名在前姓在后，例如：护照是ZHOU MARK，订票时用的MARK  ZHOU，安检值机都没影响，不会影响乘机。,从长沙机场出发的国际航班，只要旅客已经向航司成功申请了行李加重，在办理值机的时候就可以享受已经加重后的托运行李额。,旅客用台胞证拼音购买机票，登机牌只能是大陆版本拼英，请旅客在办值机的时候与值机说清楚情况请值机在登机牌上盖章，否则安检会阻拦。,送机的无陪儿童家长一般要求留在机场，直到飞机起飞才可以离开。若小孩已过安检，或者已经登机，航班延误时间较长还未起飞，家长担心小孩状况的情况下，可以让家长拨打84797373咨询。如果是南航航班，可以到A岛问询柜台咨询工作人，或者咨询84799333。
以往，无论是天气状况、空中交通管制，还是机场和航空公司方面的原因，面对航班延误或取消，旅客听到的往往是航空公司或者机场单方面给出的理由，至于是不是和实际情况相符合，旅客通常也无从知晓。,《规定》不仅明确了超过“15分钟”就算是延误，还明确了什么是“离港”，什么算是“到港”，飞机在机场滑行也算时间。,目前各个航空公司（除国航、深航、厦航、河北航、山东航、西藏航外）针对70岁以上的老人乘机可以申请办理无陪老人服务（长沙始发海航航班不可办理无陪老人服务。但是如果旅客在现场柜台申请，年龄在70岁以上，工作人员确实觉得老人身体没有问题，情况比较特殊，柜台会酌情考虑。不建议告知旅客。）但根据各航空公司规定，部分航空公司会要求老年旅客签署“航空运输免责单”；如有其他特殊情况或要求，旅客可以直接与航空公司联系。,1、目前，只实现了湖南省内公民的电子身份证在长沙黄花国际机场过安检，其他省份的会陆续开放。,●  对于携带高仿的奢侈品出境，如果只是旅客自己穿戴或使用是不做限制的，但是如果是盈利性质或者数量较多，海关根据国家保护法有责任对此进行处罚的。
送机的无陪儿童家长一般要求留在机场，直到飞机起飞才可以离开。若小孩已过安检，或者已经登机，航班延误时间较长还未起飞，家长担心小孩状况的情况下，可以让家长拨打84797373咨询。如果是南航航班，可以到A岛问询柜台咨询工作人，或者咨询84799333。,“微信值机” 开放时间与航空公司网上值机时间相同，若旅客反映官网已经可以值机了，但是我们微信不行。微信值机数据会在晚上8点更新，可建议旅客晚上8点以后再试。若还是不行可能是航司并未开放该航班权限。,取保候审人员一般是不能离开居住地的。建议旅客咨询相关公安机关，如果公安机关确认可以，机场不会做限制。,93.国内航班不超过行李尺寸的植物可以带上飞机，也可以进行托运，有根茎或者土壤的也可以。,如果旅客是长沙到香港的航班，持L签可以自由行出发。
长沙黄花国际机场停车场为您提供专属车位贵宾服务。服务内容：贵宾专属停车位、广告发布、代客泊车、贵宾通道、代办值机服务。另外贵宾同时可享受合作商铺贵宾折扣等多项增值服务。为了方便车主快速通行，免去零钱烦扰，提供充值卡服务。 营销客服、车位预订电话：18890014753,要客服务：携带中科院院士证及其它可以证明VIP身份证件的旅客，可直接到B39柜台出示相关证件可享受要客服务，专人引领使用VIP专用安检通道，引领至隔离区内靠近登机口的贵宾室休息候机。,除了民生银行的卡以外，其他需要在乐翔贵宾厅办理贵宾服务的均无需预约。,台湾落地签办理时间是跟港澳台航班走，台湾同胞如果从地区航线或国际航线到达长沙需办理落地签，可告知旅客拨打值班手机13755000637提前申请办理。,1、不论航班是否正常，自助值机柜台办理值机手续的时间均为航班原计划起飞前的两小时开始办理，起飞前的五十分钟截止办理。
