送机的无陪儿童家长一般要求留在机场，直到飞机起飞才可以离开。若小孩已过安检，或者已经登机，航班延误时间较长还未起飞，家长担心小孩状况的情况下，可以让家长拨打84797373咨询。如果是南航航班，可以到A岛问询柜台咨询工作人，或者咨询84799333。,外国人用护照购买国内航段的机票，护照名字按中国人的习惯姓在前名在后，买票时名在前姓在后，例如：护照是ZHOU MARK，订票时用的MARK  ZHOU，安检值机都没影响，不会影响乘机。,3、旅客来电反映将物品遗失在飞机上，若是刚刚下机，可联系候机寻找。,担架旅客：是指病残旅客在旅行中不能使用飞机上的座椅，只能躺卧在担架上的旅客。,26.国内航班可携带不超过随身行李重量的水果(榴莲除外)上飞机，国际航班不允许携带水果登机；如果旅客需要托运榴莲，需要向相关航空公司确认，机场这边安检一般没有问题。
去台湾必须出具往返程机票。如回程不直接回长沙，也要出具离开台湾去其他地方的行程单·,机场高速:过机场高速收费站后左转直走，看到机场公安局再右拐，直走往右边是老货站，往左边是南航货运；,机场高速：过机场高速收费站后右转可看到机场货运的指示牌，沿路直走再左拐即到新货站；,长永高速：过长永高速收费站后直走到最南边看到机场货运的指示拍后左拐，沿路直走再左拐即到新货站；,如果香港旅客想从长沙出港到台湾，无论成人还是小孩都不可以用香港护照，必须用回乡卡（港澳居民来往内地通行证）才能从长沙出境。
“微信值机” 开放时间与航空公司网上值机时间相同，若旅客反映官网已经可以值机了，但是我们微信不行。微信值机数据会在晚上8点更新，可建议旅客晚上8点以后再试。若还是不行可能是航司并未开放该航班权限。,从2014年12月20日起，每日22:30至次日05:00，T2航站楼负二层员工停车场不接受车辆进入，车辆驶出不收影响（紧急情况时可拨打长沙黄花国际机场分公司保卫部综合监察大队值班电话：13874925119、64919）,送机的无陪儿童家长一般要求留在机场，直到飞机起飞才可以离开。若小孩已过安检，或者已经登机，航班延误时间较长还未起飞，家长担心小孩状况的情况下，可以让家长拨打84797373咨询。如果是南航航班，可以到A岛问询柜台咨询工作人，或者咨询84799333。,《规定》不仅明确了超过“15分钟”就算是延误，还明确了什么是“离港”，什么算是“到港”，飞机在机场滑行也算时间。,1.国内航班早班飞机一般是从5：30开始办理值机，自助值机终端也是5：30开始才能使用。
乘坐飞机前的安检环节可能曾给很多旅客带来过困扰，尤其是在旅客身体有残疾或者携带贵重物品的情况下。因为通常情况下，安检场所是公开场所，这就意味着旅客的个人隐私可能无法得道妥善的保护。,送机的无陪儿童家长一般要求留在机场，直到飞机起飞才可以离开。若小孩已过安检，或者已经登机，航班延误时间较长还未起飞，家长担心小孩状况的情况下，可以让家长拨打84797373咨询。如果是南航航班，可以到A岛问询柜台咨询工作人，或者咨询84799333。,《规定》不仅明确了超过“15分钟”就算是延误，还明确了什么是“离港”，什么算是“到港”，飞机在机场滑行也算时间。,外国人用护照购买国内航段的机票，护照名字按中国人的习惯姓在前名在后，买票时名在前姓在后，例如：护照是ZHOU MARK，订票时用的MARK  ZHOU，安检值机都没影响，不会影响乘机。,●  对于携带高仿的奢侈品出境，如果只是旅客自己穿戴或使用是不做限制的，但是如果是盈利性质或者数量较多，海关根据国家保护法有责任对此进行处罚的。
送机的无陪儿童家长一般要求留在机场，直到飞机起飞才可以离开。若小孩已过安检，或者已经登机，航班延误时间较长还未起飞，家长担心小孩状况的情况下，可以让家长拨打84797373咨询。如果是南航航班，可以到A岛问询柜台咨询工作人，或者咨询84799333。,《规定》不仅明确了超过“15分钟”就算是延误，还明确了什么是“离港”，什么算是“到港”，飞机在机场滑行也算时间。,外国人用护照购买国内航段的机票，护照名字按中国人的习惯姓在前名在后，买票时名在前姓在后，例如：护照是ZHOU MARK，订票时用的MARK  ZHOU，安检值机都没影响，不会影响乘机。,以往，无论是天气状况、空中交通管制，还是机场和航空公司方面的原因，面对航班延误或取消，旅客听到的往往是航空公司或者机场单方面给出的理由，至于是不是和实际情况相符合，旅客通常也无从知晓。,国内航班，未孵化的虫卵，绝对不允许带入客舱，也不建议托运，最好先咨询承运人征得同意之后走货运。如果是标本，也建议打包好了之后托运，但也要经过安检现场检测后才可放行。
二、始发站的要客服务部门应在重要旅客乘坐航班飞行前一天编制次日航班的重要旅客名单表，并于航班飞行前一日分别送给管理局、公司、机场或省局、航站、分公司的领导和各有关业务部门。临时收到的要客信息要及时补充通知。,旅客托运行李内部分物品丢失：目的地为长沙的航班，旅客未出机场隔离区可以建议旅客跟行李查询室联系，离开机场建议旅客联系公安机关报案处理；长沙始发的航班建议旅客联系到达机场。,1、接到旅客对出租车事项的投诉，首先与旅客确认是投诉出租车司机还是机场站点的地面执法人员；,南航国际发货和提货电话均为84797562 ，地址在机场新货运站旁南航国际货运的办公室。,涉及飞机安全管制的，如饮料、水、电池及其他金属物品等，应咨询机场安检部门。涉及海关管理的，还有疑惑，机场海关旅检科电话8499887，84798686.
送机的无陪儿童家长一般要求留在机场，直到飞机起飞才可以离开。若小孩已过安检，或者已经登机，航班延误时间较长还未起飞，家长担心小孩状况的情况下，可以让家长拨打84797373咨询。如果是南航航班，可以到A岛问询柜台咨询工作人，或者咨询84799333。,外国人用护照购买国内航段的机票，护照名字按中国人的习惯姓在前名在后，买票时名在前姓在后，例如：护照是ZHOU MARK，订票时用的MARK  ZHOU，安检值机都没影响，不会影响乘机。,《规定》不仅明确了超过“15分钟”就算是延误，还明确了什么是“离港”，什么算是“到港”，飞机在机场滑行也算时间。,“微信值机” 开放时间与航空公司网上值机时间相同，若旅客反映官网已经可以值机了，但是我们微信不行。微信值机数据会在晚上8点更新，可建议旅客晚上8点以后再试。若还是不行可能是航司并未开放该航班权限。,国内航班，未孵化的虫卵，绝对不允许带入客舱，也不建议托运，最好先咨询承运人征得同意之后走货运。如果是标本，也建议打包好了之后托运，但也要经过安检现场检测后才可放行。
从2014年12月20日起，每日22:30至次日05:00，T2航站楼负二层员工停车场不接受车辆进入，车辆驶出不收影响（紧急情况时可拨打长沙黄花国际机场分公司保卫部综合监察大队值班电话：13874925119、64919）,1、目前，只实现了湖南省内公民的电子身份证在长沙黄花国际机场过安检，其他省份的会陆续开放。,3、按照《中华人员共和国反恐怖主义法》、《道路旅客运输及客运站管理规定》的相关规定，机场巴士机场始发长途班次（浏阳、株洲、湘潭、常德、益阳、萍乡）自2017年9月24日起实行实名制管理，包括实名制售票和实名检票两个环节。请您主动出示有效身份证件，感谢您的配合！,4、汽车南站：原汽车南站已搬至新的过度站，新的具体地点：中意路与万芙路交汇处东北角，也可跟旅客描述为万芙路 湘中物流旁。站内机场巴士统一在大厅窗口买票，乘车在负一楼，原联系方式已停用，统一告知0731-84798076。,黄花机场停车场设有两处车辆集中停放区域，分别为T1、T2航站楼停车场。（T1航站楼停车场于2018年5月16日重新启用）
机场始发的机场大巴从T2始发，经停T1，行驶时间约5分钟；市内大巴到达机场后皆先停靠T2，最后开至T1。,“航班延误”，是指航班实际到港轮挡时间，晚于计划到港时间超过15分钟的情况；“航班出港延误”，是指航班实际出港撤轮挡时间，晚于计划出港时间超过15分钟的情况。,如果香港旅客想从长沙出港到台湾，无论成人还是小孩都不可以用香港护照，必须用回乡卡（港澳居民来往内地通行证）才能从长沙出境。,2、黄花机场可购买龙骧集团省内长途汽车票：自2017年1月1日起，旅客可在黄花机场到达层机场巴士售票柜台购买龙骧集团各大汽车站的长途汽车票，（包括汽车东站、汽车南站、汽车西站、黎托汽车站、长株潭汽车站、浏阳汽车站）。欢迎有需要的旅客前来咨询购买。详情请咨询0731-84798076。,9. 旅客从长沙机场发货后，如果将收货人的名字填写错误导致收货人在对方机场提不到货，需要发货人将发货时的回执单传真回机场货运（或者拿原件回机场），长沙机场修改收货人姓名之后发电报到对方机场，收货人才可以提到货。
黄花机场停车场设有两处车辆集中停放区域，分别为T1、T2航站楼停车场。（T1航站楼停车场于2018年5月16日重新启用）,2.厦航机场售票柜台（长沙黄花国际机场T2航站楼国内出发厅1号和2号门之间）,1、机场巴士站：位于长沙黄花国际机场T2航站楼到达层，在到达厅大内设有售票、咨询柜台和专用候车室，在到达大厅外设有15个班线发车站台。,长沙黄花国际机场巴士时刻表,T1航站楼到达层不对旅游大巴车开放，车辆可停在T1停车场B区（P5大巴停车场）上客。
长沙黄花国际机场停车场为您提供专属车位贵宾服务。服务内容：贵宾专属停车位、广告发布、代客泊车、贵宾通道、代办值机服务。另外贵宾同时可享受合作商铺贵宾折扣等多项增值服务。为了方便车主快速通行，免去零钱烦扰，提供充值卡服务。 营销客服、车位预订电话：18890014753,长沙机场出港海航航班的折扣头等舱不享受地面贵宾服务，机上可以享受同等服务；其他航空公司的折扣与正价头等舱均享受同等的机上和地面贵宾服务。,（非头等舱、非金银卡）客户可通过支付现金的方式获取贵宾服务，包括南航旅客，也可承接国际航班的贵宾服务；,2、黄花机场可购买龙骧集团省内长途汽车票：自2017年1月1日起，旅客可在黄花机场到达层机场巴士售票柜台购买龙骧集团各大汽车站的长途汽车票，（包括汽车东站、汽车南站、汽车西站、黎托汽车站、长株潭汽车站、浏阳汽车站）。欢迎有需要的旅客前来咨询购买。详情请咨询0731-84798076。,商务贵宾厅停车场主要针对商务贵宾旅客车辆临时停放，不能过夜。停放免费，但是必须要提前预约。政务贵宾厅停车场不对外开放，主要是省委领导等领导使用，停放免费。
长沙黄花国际机场巴士时刻表,2、长沙火车站（民航大酒店）：位于长沙市芙蓉区五一东路，紧邻长沙火车站、长株潭汽车站。机场巴士停靠民航大酒店院内。,7、星沙：位于长沙市东北侧，是长沙县城区和国家级经济技术开发区，紧邻芙蓉区、开福区。机场巴士临时停靠开元西路湘府金龙大酒店。,2.厦航机场售票柜台（长沙黄花国际机场T2航站楼国内出发厅1号和2号门之间）,12、常德（民航宾馆）：位于常德市武陵区武陵大道，紧邻滨湖路、洞庭大道 。机场巴士停靠在常德民航售票处停车坪。
机场始发的机场大巴从T2始发，经停T1，行驶时间约5分钟；市内大巴到达机场后皆先停靠T2，最后开至T1。,如出租车司机的行驶证在机场被扣留，须在机场执法大队缴纳罚款，可以联系 84799498 （行政班），地址在机场篮球场附近。,送机的无陪儿童家长一般要求留在机场，直到飞机起飞才可以离开。若小孩已过安检，或者已经登机，航班延误时间较长还未起飞，家长担心小孩状况的情况下，可以让家长拨打84797373咨询。如果是南航航班，可以到A岛问询柜台咨询工作人，或者咨询84799333。,机场高速:过机场高速收费站后左转直走，看到机场公安局再右拐，直走往右边是老货站，往左边是南航货运；,4、汽车南站：原汽车南站已搬至新的过度站，新的具体地点：中意路与万芙路交汇处东北角，也可跟旅客描述为万芙路 湘中物流旁。站内机场巴士统一在大厅窗口买票，乘车在负一楼，原联系方式已停用，统一告知0731-84798076。
送机的无陪儿童家长一般要求留在机场，直到飞机起飞才可以离开。若小孩已过安检，或者已经登机，航班延误时间较长还未起飞，家长担心小孩状况的情况下，可以让家长拨打84797373咨询。如果是南航航班，可以到A岛问询柜台咨询工作人，或者咨询84799333。,4、汽车南站：原汽车南站已搬至新的过度站，新的具体地点：中意路与万芙路交汇处东北角，也可跟旅客描述为万芙路 湘中物流旁。站内机场巴士统一在大厅窗口买票，乘车在负一楼，原联系方式已停用，统一告知0731-84798076。,31. 鸡蛋长沙机场暂可以作手提行李携带上飞机。,3、旅客来电反映将物品遗失在飞机上，若是刚刚下机，可联系候机寻找。,如果香港旅客想从长沙出港到台湾，无论成人还是小孩都不可以用香港护照，必须用回乡卡（港澳居民来往内地通行证）才能从长沙出境。
4、汽车南站：原汽车南站已搬至新的过度站，新的具体地点：中意路与万芙路交汇处东北角，也可跟旅客描述为万芙路 湘中物流旁。站内机场巴士统一在大厅窗口买票，乘车在负一楼，原联系方式已停用，统一告知0731-84798076。,1、目前，只实现了湖南省内公民的电子身份证在长沙黄花国际机场过安检，其他省份的会陆续开放。,机场始发的机场大巴从T2始发，经停T1，行驶时间约5分钟；市内大巴到达机场后皆先停靠T2，最后开至T1。,如果香港旅客想从长沙出港到台湾，无论成人还是小孩都不可以用香港护照，必须用回乡卡（港澳居民来往内地通行证）才能从长沙出境。,2、黄花机场可购买龙骧集团省内长途汽车票：自2017年1月1日起，旅客可在黄花机场到达层机场巴士售票柜台购买龙骧集团各大汽车站的长途汽车票，（包括汽车东站、汽车南站、汽车西站、黎托汽车站、长株潭汽车站、浏阳汽车站）。欢迎有需要的旅客前来咨询购买。详情请咨询0731-84798076。
长沙黄花国际机场巴士时刻表,1、机场巴士站：位于长沙黄花国际机场T2航站楼到达层，在到达厅大内设有售票、咨询柜台和专用候车室，在到达大厅外设有15个班线发车站台。,2.厦航机场售票柜台（长沙黄花国际机场T2航站楼国内出发厅1号和2号门之间）,机场：T1、T2航站楼一楼到达层内，其他各起点站均有售票点,2、长沙火车站（民航大酒店）：位于长沙市芙蓉区五一东路，紧邻长沙火车站、长株潭汽车站。机场巴士停靠民航大酒店院内。
如果旅客使用护照购买了国内转国际的联程机票，可以建议旅客请原售票点在国内段备注身份证号码；如无法备注可以使用护照复印件和身份证从长沙机场乘机前往转机地。,去台湾必须出具往返程机票。如回程不直接回长沙，也要出具离开台湾去其他地方的行程单·,c.	旅客在机场登机牌遗失，在该航班规定值机时间内可以在机场相应开放的柜台进行补打登机牌，不限在国内值机主任柜台。如果旅客的登机牌为航空公司官网通过网上值机打印，也是同样规定。,旅客用台胞证拼音购买机票，登机牌只能是大陆版本拼英，请旅客在办值机的时候与值机说清楚情况请值机在登机牌上盖章，否则安检会阻拦。,无陪儿童服务一般需要旅客购买无陪儿童机票且向相应航司申请无陪儿童服务。没有任何证件的无陪儿童买机票与航空公司营业部联系，如果买到UM票。可以办理无陪。旅客可凭无陪申请单到机场联系84797373办理相关手续；如果是南航航班，可以到A岛问询柜台咨询工作人，或者咨询84799333。
长沙黄花国际机场巴士时刻表,旅客托运行李内部分物品丢失：目的地为长沙的航班，旅客未出机场隔离区可以建议旅客跟行李查询室联系，离开机场建议旅客联系公安机关报案处理；长沙始发的航班建议旅客联系到达机场。,2.厦航机场售票柜台（长沙黄花国际机场T2航站楼国内出发厅1号和2号门之间）,黄花机场机公安办理临时乘机证明的位置：T2航站楼安检16号通道边设有办理柜台,31. 鸡蛋长沙机场暂可以作手提行李携带上飞机。
长沙机场出港海航航班的折扣头等舱不享受地面贵宾服务，机上可以享受同等服务；其他航空公司的折扣与正价头等舱均享受同等的机上和地面贵宾服务。,凭常旅客卡可进入头等舱休息室及免费行李额度：,2.厦航机场售票柜台（长沙黄花国际机场T2航站楼国内出发厅1号和2号门之间）,长沙黄花国际机场巴士时刻表,机场南航贵宾厅内只提供南航航班信息广播，如旅客乘坐除南航以外的航班，持南航贵宾卡在贵宾厅休息，将会听不到航班信息，请提醒旅客。
送机的无陪儿童家长一般要求留在机场，直到飞机起飞才可以离开。若小孩已过安检，或者已经登机，航班延误时间较长还未起飞，家长担心小孩状况的情况下，可以让家长拨打84797373咨询。如果是南航航班，可以到A岛问询柜台咨询工作人，或者咨询84799333。,机场始发的机场大巴从T2始发，经停T1，行驶时间约5分钟；市内大巴到达机场后皆先停靠T2，最后开至T1。,“微信值机” 开放时间与航空公司网上值机时间相同，若旅客反映官网已经可以值机了，但是我们微信不行。微信值机数据会在晚上8点更新，可建议旅客晚上8点以后再试。若还是不行可能是航司并未开放该航班权限。,《规定》不仅明确了超过“15分钟”就算是延误，还明确了什么是“离港”，什么算是“到港”，飞机在机场滑行也算时间。,1、航班起飞前40分钟开始登机，航班起飞前15分钟停止登机，开始登机时机场中央大广播会自动播放登机广播，主要是催促已经办理值机手续但还未过安检的旅客尽快过安检，开始登机后登机口也会有相应区域广播，主要是航班动态、登机口变更以及催促旅客登机广播，该广播覆盖范围有限，若旅客离开登机口则有可能听不到。若旅客来电质疑没有听到广播通知，中央大广播记录可联系广播室查询，登机口区域广播可联系候机查询，但广播录音均不可对外。
1、目前，只实现了湖南省内公民的电子身份证在长沙黄花国际机场过安检，其他省份的会陆续开放。,1、机场巴士站：位于长沙黄花国际机场T2航站楼到达层，在到达厅大内设有售票、咨询柜台和专用候车室，在到达大厅外设有15个班线发车站台。,有三个国际贵宾厅，都在国际出发过安检后的左侧,如果旅客购买长沙到上海转飞国际的机票，国内和国际段均为东航航班但是非联程航班，无法申请国内段行李额加重。,4、汽车南站：原汽车南站已搬至新的过度站，新的具体地点：中意路与万芙路交汇处东北角，也可跟旅客描述为万芙路 湘中物流旁。站内机场巴士统一在大厅窗口买票，乘车在负一楼，原联系方式已停用，统一告知0731-84798076。
1、机场巴士站：位于长沙黄花国际机场T2航站楼到达层，在到达厅大内设有售票、咨询柜台和专用候车室，在到达大厅外设有15个班线发车站台。,2.厦航机场售票柜台（长沙黄花国际机场T2航站楼国内出发厅1号和2号门之间）,2、黄花机场可购买龙骧集团省内长途汽车票：自2017年1月1日起，旅客可在黄花机场到达层机场巴士售票柜台购买龙骧集团各大汽车站的长途汽车票，（包括汽车东站、汽车南站、汽车西站、黎托汽车站、长株潭汽车站、浏阳汽车站）。欢迎有需要的旅客前来咨询购买。详情请咨询0731-84798076。,4、汽车南站：原汽车南站已搬至新的过度站，新的具体地点：中意路与万芙路交汇处东北角，也可跟旅客描述为万芙路 湘中物流旁。站内机场巴士统一在大厅窗口买票，乘车在负一楼，原联系方式已停用，统一告知0731-84798076。,1、目前，只实现了湖南省内公民的电子身份证在长沙黄花国际机场过安检，其他省份的会陆续开放。
三、始发站的值机部门在航班起飞后，应即拍发要客VIP电报，通知各有关中途站和到达站的要客服务部门，要客服务部门再通知驻机场各有关单位领导和各有关业务部门。要客电报应包括：航班、日期、飞机号码、要客姓名、职务、人数、行李件数和舱位等内容。,二、始发站的要客服务部门应在重要旅客乘坐航班飞行前一天编制次日航班的重要旅客名单表，并于航班飞行前一日分别送给管理局、公司、机场或省局、航站、分公司的领导和各有关业务部门。临时收到的要客信息要及时补充通知。,四、航班不正常时，始发站商务调度部门，应及时将航班延误情况发电告各有关经停站和到达站要客服务部门，要客服务部门应及时报告有关领导、部门和接待单位。,目前各个航空公司（除国航、深航、厦航、河北航、山东航、西藏航外）针对70岁以上的老人乘机可以申请办理无陪老人服务（长沙始发海航航班不可办理无陪老人服务。但是如果旅客在现场柜台申请，年龄在70岁以上，工作人员确实觉得老人身体没有问题，情况比较特殊，柜台会酌情考虑。不建议告知旅客。）但根据各航空公司规定，部分航空公司会要求老年旅客签署“航空运输免责单”；如有其他特殊情况或要求，旅客可以直接与航空公司联系。,二、航空公司，省局、航站要设立要客服务部门(含兼管部门)，并将该部门的职责、电话号码等通知当地党、政、军等有关部门。
