送机的无陪儿童家长一般要求留在机场，直到飞机起飞才可以离开。若小孩已过安检，或者已经登机，航班延误时间较长还未起飞，家长担心小孩状况的情况下，可以让家长拨打84797373咨询。如果是南航航班，可以到A岛问询柜台咨询工作人，或者咨询84799333。,无陪儿童服务一般需要旅客购买无陪儿童机票且向相应航司申请无陪儿童服务。没有任何证件的无陪儿童买机票与航空公司营业部联系，如果买到UM票。可以办理无陪。旅客可凭无陪申请单到机场联系84797373办理相关手续；如果是南航航班，可以到A岛问询柜台咨询工作人，或者咨询84799333。,1、航班起飞前40分钟开始登机，航班起飞前15分钟停止登机，开始登机时机场中央大广播会自动播放登机广播，主要是催促已经办理值机手续但还未过安检的旅客尽快过安检，开始登机后登机口也会有相应区域广播，主要是航班动态、登机口变更以及催促旅客登机广播，该广播覆盖范围有限，若旅客离开登机口则有可能听不到。若旅客来电质疑没有听到广播通知，中央大广播记录可联系广播室查询，登机口区域广播可联系候机查询，但广播录音均不可对外。,宠物托运流程，小宠物狗托运时，旅客在航空公司办好相关申请手续后，可以提前到机场值机柜台办理托运手续，大型狗需要走货物托运，如无法判断宠物的大小，建议旅客提前与航空公司联系，或提前到机场咨询现场工作人员；,2、旅客质疑登机口无工作人员，可告知旅客候机工作人员工作地点并不固定，可能目前还在其他登机口办理旅客登机服务，等旅客的航班快到登机时间工作人员会提前过来。若已经到登机时间还无工作人员可联系候机室确认。
旅客托运行李内部分物品丢失：目的地为长沙的航班，旅客未出机场隔离区可以建议旅客跟行李查询室联系，离开机场建议旅客联系公安机关报案处理；长沙始发的航班建议旅客联系到达机场。,机场始发的机场大巴从T2始发，经停T1，行驶时间约5分钟；市内大巴到达机场后皆先停靠T2，最后开至T1。,9. 旅客从长沙机场发货后，如果将收货人的名字填写错误导致收货人在对方机场提不到货，需要发货人将发货时的回执单传真回机场货运（或者拿原件回机场），长沙机场修改收货人姓名之后发电报到对方机场，收货人才可以提到货。,1、航班起飞前40分钟开始登机，航班起飞前15分钟停止登机，开始登机时机场中央大广播会自动播放登机广播，主要是催促已经办理值机手续但还未过安检的旅客尽快过安检，开始登机后登机口也会有相应区域广播，主要是航班动态、登机口变更以及催促旅客登机广播，该广播覆盖范围有限，若旅客离开登机口则有可能听不到。若旅客来电质疑没有听到广播通知，中央大广播记录可联系广播室查询，登机口区域广播可联系候机查询，但广播录音均不可对外。,以往，无论是天气状况、空中交通管制，还是机场和航空公司方面的原因，面对航班延误或取消，旅客听到的往往是航空公司或者机场单方面给出的理由，至于是不是和实际情况相符合，旅客通常也无从知晓。
旅客值机后航班延误需要取消行程办理退票，若旅客还在机场可到原值机柜台退回登机牌，再联系原售票处办理退票，若已经离开机场，可不退回登机牌，旅客客票状态会在飞机起飞后自动变回未使用，建议旅客次日再联系售票处办理退票，若旅客客票状态一直未值机状态不能退票，客服人员可记录旅客客票信息再联系值机取消。,c.	旅客在机场登机牌遗失，在该航班规定值机时间内可以在机场相应开放的柜台进行补打登机牌，不限在国内值机主任柜台。如果旅客的登机牌为航空公司官网通过网上值机打印，也是同样规定。,机场南航贵宾厅内只提供南航航班信息广播，如旅客乘坐除南航以外的航班，持南航贵宾卡在贵宾厅休息，将会听不到航班信息，请提醒旅客。,如果旅客要求取消值机，一般情况下旅客值机在哪办理就在哪取消。若旅客人在机场可提供乘机人身份证原件和登机牌到机场开放的值机柜台取消值机，若旅客已经离开机场，可告知旅客正常情况下24小时候会自动取消登机状态，若超过24小时仍未取消可记录旅客姓名证件号码以及航班信息由坐席员联系值机取消。,旅客用台胞证拼音购买机票，登机牌只能是大陆版本拼英，请旅客在办值机的时候与值机说清楚情况请值机在登机牌上盖章，否则安检会阻拦。
一、乘务组应事先掌握重要旅客身份和是否有特殊服务的要求，并根据掌握的情况研究具体服务方案。,病残旅客：是指由于在精神或身体上有缺陷（或病态）而无自理能力，或其行动需要他人照料的旅客。如果是一名年事甚高的旅客，即使该旅客没有疾病，也作为该类旅客处理，给予特殊服务。,需要轮椅服务的旅客建议提前向航空公司申请。在办理手续时需要出具医疗部门出具的适宜乘机“诊断证明书”和“特殊旅客乘机申请书”；旅客自带轮椅需要办理行李托运手续，轮椅的重量一般不计入旅客的免费行李额内；旅客在隔离区内必须使用机场提供的轮椅。,盲人旅客：是指双目失明，单独旅行，需要承运人提供特殊服务的旅客。,乘坐飞机前的安检环节可能曾给很多旅客带来过困扰，尤其是在旅客身体有残疾或者携带贵重物品的情况下。因为通常情况下，安检场所是公开场所，这就意味着旅客的个人隐私可能无法得道妥善的保护。
1、航班起飞前40分钟开始登机，航班起飞前15分钟停止登机，开始登机时机场中央大广播会自动播放登机广播，主要是催促已经办理值机手续但还未过安检的旅客尽快过安检，开始登机后登机口也会有相应区域广播，主要是航班动态、登机口变更以及催促旅客登机广播，该广播覆盖范围有限，若旅客离开登机口则有可能听不到。若旅客来电质疑没有听到广播通知，中央大广播记录可联系广播室查询，登机口区域广播可联系候机查询，但广播录音均不可对外。,如果旅客要求取消值机，一般情况下旅客值机在哪办理就在哪取消。若旅客人在机场可提供乘机人身份证原件和登机牌到机场开放的值机柜台取消值机，若旅客已经离开机场，可告知旅客正常情况下24小时候会自动取消登机状态，若超过24小时仍未取消可记录旅客姓名证件号码以及航班信息由坐席员联系值机取消。,1、目前，只实现了湖南省内公民的电子身份证在长沙黄花国际机场过安检，其他省份的会陆续开放。,如出租车司机的行驶证在机场被扣留，须在机场执法大队缴纳罚款，可以联系 84799498 （行政班），地址在机场篮球场附近。,国内航班，未孵化的虫卵，绝对不允许带入客舱，也不建议托运，最好先咨询承运人征得同意之后走货运。如果是标本，也建议打包好了之后托运，但也要经过安检现场检测后才可放行。
轮椅旅客：是指身体适宜乘机，行动不便，需要轮椅代步的旅客。,40.联程航班需要带胰岛素，旅客可以携带两次使用的量，备齐病历本和登机牌，现场与安检沟通即可。,26.国内航班可携带不超过随身行李重量的水果(榴莲除外)上飞机，国际航班不允许携带水果登机；如果旅客需要托运榴莲，需要向相关航空公司确认，机场这边安检一般没有问题。,31. 鸡蛋长沙机场暂可以作手提行李携带上飞机。,93.国内航班不超过行李尺寸的植物可以带上飞机，也可以进行托运，有根茎或者土壤的也可以。
送机的无陪儿童家长一般要求留在机场，直到飞机起飞才可以离开。若小孩已过安检，或者已经登机，航班延误时间较长还未起飞，家长担心小孩状况的情况下，可以让家长拨打84797373咨询。如果是南航航班，可以到A岛问询柜台咨询工作人，或者咨询84799333。,国内航班，未孵化的虫卵，绝对不允许带入客舱，也不建议托运，最好先咨询承运人征得同意之后走货运。如果是标本，也建议打包好了之后托运，但也要经过安检现场检测后才可放行。,外国人用护照购买国内航段的机票，护照名字按中国人的习惯姓在前名在后，买票时名在前姓在后，例如：护照是ZHOU MARK，订票时用的MARK  ZHOU，安检值机都没影响，不会影响乘机。,93.国内航班不超过行李尺寸的植物可以带上飞机，也可以进行托运，有根茎或者土壤的也可以。,h.12岁以下儿童或婴儿无法提供任何纸质证明，家人也不清楚孩子的任何证件号码，如果已经上户且为湖南省内户口，机场公安办可以根据父母的信息调取孩子的信息，如查实真实有效，可以开具临时登机证明。
送机的无陪儿童家长一般要求留在机场，直到飞机起飞才可以离开。若小孩已过安检，或者已经登机，航班延误时间较长还未起飞，家长担心小孩状况的情况下，可以让家长拨打84797373咨询。如果是南航航班，可以到A岛问询柜台咨询工作人，或者咨询84799333。,外国人用护照购买国内航段的机票，护照名字按中国人的习惯姓在前名在后，买票时名在前姓在后，例如：护照是ZHOU MARK，订票时用的MARK  ZHOU，安检值机都没影响，不会影响乘机。,无陪儿童服务一般需要旅客购买无陪儿童机票且向相应航司申请无陪儿童服务。没有任何证件的无陪儿童买机票与航空公司营业部联系，如果买到UM票。可以办理无陪。旅客可凭无陪申请单到机场联系84797373办理相关手续；如果是南航航班，可以到A岛问询柜台咨询工作人，或者咨询84799333。,乘坐飞机前的安检环节可能曾给很多旅客带来过困扰，尤其是在旅客身体有残疾或者携带贵重物品的情况下。因为通常情况下，安检场所是公开场所，这就意味着旅客的个人隐私可能无法得道妥善的保护。,旅客用台胞证拼音购买机票，登机牌只能是大陆版本拼英，请旅客在办值机的时候与值机说清楚情况请值机在登机牌上盖章，否则安检会阻拦。
长沙黄花国际机场巴士时刻表,2.厦航机场售票柜台（长沙黄花国际机场T2航站楼国内出发厅1号和2号门之间）,黄花机场机公安办理临时乘机证明的位置：T2航站楼安检16号通道边设有办理柜台,2、黄花机场可购买龙骧集团省内长途汽车票：自2017年1月1日起，旅客可在黄花机场到达层机场巴士售票柜台购买龙骧集团各大汽车站的长途汽车票，（包括汽车东站、汽车南站、汽车西站、黎托汽车站、长株潭汽车站、浏阳汽车站）。欢迎有需要的旅客前来咨询购买。详情请咨询0731-84798076。,c.	旅客在机场登机牌遗失，在该航班规定值机时间内可以在机场相应开放的柜台进行补打登机牌，不限在国内值机主任柜台。如果旅客的登机牌为航空公司官网通过网上值机打印，也是同样规定。
无陪儿童服务一般需要旅客购买无陪儿童机票且向相应航司申请无陪儿童服务。没有任何证件的无陪儿童买机票与航空公司营业部联系，如果买到UM票。可以办理无陪。旅客可凭无陪申请单到机场联系84797373办理相关手续；如果是南航航班，可以到A岛问询柜台咨询工作人，或者咨询84799333。,如果旅客使用护照购买了国内转国际的联程机票，可以建议旅客请原售票点在国内段备注身份证号码；如无法备注可以使用护照复印件和身份证从长沙机场乘机前往转机地。,2、黄花机场可购买龙骧集团省内长途汽车票：自2017年1月1日起，旅客可在黄花机场到达层机场巴士售票柜台购买龙骧集团各大汽车站的长途汽车票，（包括汽车东站、汽车南站、汽车西站、黎托汽车站、长株潭汽车站、浏阳汽车站）。欢迎有需要的旅客前来咨询购买。详情请咨询0731-84798076。,9. 旅客从长沙机场发货后，如果将收货人的名字填写错误导致收货人在对方机场提不到货，需要发货人将发货时的回执单传真回机场货运（或者拿原件回机场），长沙机场修改收货人姓名之后发电报到对方机场，收货人才可以提到货。,宠物托运流程，小宠物狗托运时，旅客在航空公司办好相关申请手续后，可以提前到机场值机柜台办理托运手续，大型狗需要走货物托运，如无法判断宠物的大小，建议旅客提前与航空公司联系，或提前到机场咨询现场工作人员；
外国人用护照购买国内航段的机票，护照名字按中国人的习惯姓在前名在后，买票时名在前姓在后，例如：护照是ZHOU MARK，订票时用的MARK  ZHOU，安检值机都没影响，不会影响乘机。,h.12岁以下儿童或婴儿无法提供任何纸质证明，家人也不清楚孩子的任何证件号码，如果已经上户且为湖南省内户口，机场公安办可以根据父母的信息调取孩子的信息，如查实真实有效，可以开具临时登机证明。,旅客用台胞证拼音购买机票，登机牌只能是大陆版本拼英，请旅客在办值机的时候与值机说清楚情况请值机在登机牌上盖章，否则安检会阻拦。,d.	证件只认可扫描件、复印件以及传真件，用手机拍照下来的或是拍照下来后打印出来的不认可，拍照之后打印出来的能够证明身份的证件，可以在公安执勤点换取临时乘机证明。,如果旅客需要办理宠物托运（跟航班走）必须要有由正规的检验检疫单位开具的动物检疫证明与消毒证明（一般宠物医院开具的无效），旅客如果有湖南省宠物免疫证也是无法办理宠物托运的。建议旅客先要咨询好办证点是否是正规单位，最后就是购票同时向航司确认，乘坐的航班是否是有氧舱，航司是否同意办理宠物托运。
《规定》不仅明确了超过“15分钟”就算是延误，还明确了什么是“离港”，什么算是“到港”，飞机在机场滑行也算时间。,航班延误后第二天有补班的情况，以下规定是区分第二天针对前一天哪个航班的补班：第二天补班的航班号最后一位数是英文字母，英文字母对应不同的数字就是前一天延误的航班号的最后一位数,外国人用护照购买国内航段的机票，护照名字按中国人的习惯姓在前名在后，买票时名在前姓在后，例如：护照是ZHOU MARK，订票时用的MARK  ZHOU，安检值机都没影响，不会影响乘机。,以往，无论是天气状况、空中交通管制，还是机场和航空公司方面的原因，面对航班延误或取消，旅客听到的往往是航空公司或者机场单方面给出的理由，至于是不是和实际情况相符合，旅客通常也无从知晓。,旅客用台胞证拼音购买机票，登机牌只能是大陆版本拼英，请旅客在办值机的时候与值机说清楚情况请值机在登机牌上盖章，否则安检会阻拦。
外国人用护照购买国内航段的机票，护照名字按中国人的习惯姓在前名在后，买票时名在前姓在后，例如：护照是ZHOU MARK，订票时用的MARK  ZHOU，安检值机都没影响，不会影响乘机。,从长沙机场出发的国际航班，只要旅客已经向航司成功申请了行李加重，在办理值机的时候就可以享受已经加重后的托运行李额。,乘坐飞机前的安检环节可能曾给很多旅客带来过困扰，尤其是在旅客身体有残疾或者携带贵重物品的情况下。因为通常情况下，安检场所是公开场所，这就意味着旅客的个人隐私可能无法得道妥善的保护。,国内航班，未孵化的虫卵，绝对不允许带入客舱，也不建议托运，最好先咨询承运人征得同意之后走货运。如果是标本，也建议打包好了之后托运，但也要经过安检现场检测后才可放行。,93.国内航班不超过行李尺寸的植物可以带上飞机，也可以进行托运，有根茎或者土壤的也可以。
无陪儿童服务一般需要旅客购买无陪儿童机票且向相应航司申请无陪儿童服务。没有任何证件的无陪儿童买机票与航空公司营业部联系，如果买到UM票。可以办理无陪。旅客可凭无陪申请单到机场联系84797373办理相关手续；如果是南航航班，可以到A岛问询柜台咨询工作人，或者咨询84799333。,送机的无陪儿童家长一般要求留在机场，直到飞机起飞才可以离开。若小孩已过安检，或者已经登机，航班延误时间较长还未起飞，家长担心小孩状况的情况下，可以让家长拨打84797373咨询。如果是南航航班，可以到A岛问询柜台咨询工作人，或者咨询84799333。,旅客用台胞证拼音购买机票，登机牌只能是大陆版本拼英，请旅客在办值机的时候与值机说清楚情况请值机在登机牌上盖章，否则安检会阻拦。,去台湾必须出具往返程机票。如回程不直接回长沙，也要出具离开台湾去其他地方的行程单·,外国人用护照购买国内航段的机票，护照名字按中国人的习惯姓在前名在后，买票时名在前姓在后，例如：护照是ZHOU MARK，订票时用的MARK  ZHOU，安检值机都没影响，不会影响乘机。
黄花机场机公安办理临时乘机证明的位置：T2航站楼安检16号通道边设有办理柜台,美国国籍的6岁儿童可用旅游证复印件或传真件乘坐长沙出港航班。机场公安方面：外籍旅客不能开具临时乘机证明（因为中国公安户籍系统中查询不到户籍记录）,a.需要办理临时登机证明的旅客，可到T2航站楼始发层16号号安检口附近公安执勤点办理。,根据《民用航空安全检查规则》第三十一条用身份证买票持护照过检，原则上不予放行，可请旅客前往机场派出所开具临时乘机证明。,c.	旅客在机场登机牌遗失，在该航班规定值机时间内可以在机场相应开放的柜台进行补打登机牌，不限在国内值机主任柜台。如果旅客的登机牌为航空公司官网通过网上值机打印，也是同样规定。
旅客托运行李内部分物品丢失：目的地为长沙的航班，旅客未出机场隔离区可以建议旅客跟行李查询室联系，离开机场建议旅客联系公安机关报案处理；长沙始发的航班建议旅客联系到达机场。,c.	旅客在机场登机牌遗失，在该航班规定值机时间内可以在机场相应开放的柜台进行补打登机牌，不限在国内值机主任柜台。如果旅客的登机牌为航空公司官网通过网上值机打印，也是同样规定。,旅客托运行李未随机到达，若是落地长沙的航班可记录行李单号及航班号至行李查询处查询。,如果旅客要求取消值机，一般情况下旅客值机在哪办理就在哪取消。若旅客人在机场可提供乘机人身份证原件和登机牌到机场开放的值机柜台取消值机，若旅客已经离开机场，可告知旅客正常情况下24小时候会自动取消登机状态，若超过24小时仍未取消可记录旅客姓名证件号码以及航班信息由坐席员联系值机取消。,1、航班起飞前40分钟开始登机，航班起飞前15分钟停止登机，开始登机时机场中央大广播会自动播放登机广播，主要是催促已经办理值机手续但还未过安检的旅客尽快过安检，开始登机后登机口也会有相应区域广播，主要是航班动态、登机口变更以及催促旅客登机广播，该广播覆盖范围有限，若旅客离开登机口则有可能听不到。若旅客来电质疑没有听到广播通知，中央大广播记录可联系广播室查询，登机口区域广播可联系候机查询，但广播录音均不可对外。
c.	旅客在机场登机牌遗失，在该航班规定值机时间内可以在机场相应开放的柜台进行补打登机牌，不限在国内值机主任柜台。如果旅客的登机牌为航空公司官网通过网上值机打印，也是同样规定。,如果旅客要求取消值机，一般情况下旅客值机在哪办理就在哪取消。若旅客人在机场可提供乘机人身份证原件和登机牌到机场开放的值机柜台取消值机，若旅客已经离开机场，可告知旅客正常情况下24小时候会自动取消登机状态，若超过24小时仍未取消可记录旅客姓名证件号码以及航班信息由坐席员联系值机取消。,旅客用台胞证拼音购买机票，登机牌只能是大陆版本拼英，请旅客在办值机的时候与值机说清楚情况请值机在登机牌上盖章，否则安检会阻拦。,如果旅客使用护照购买了国内转国际的联程机票，可以建议旅客请原售票点在国内段备注身份证号码；如无法备注可以使用护照复印件和身份证从长沙机场乘机前往转机地。,旅客值机后航班延误需要取消行程办理退票，若旅客还在机场可到原值机柜台退回登机牌，再联系原售票处办理退票，若已经离开机场，可不退回登机牌，旅客客票状态会在飞机起飞后自动变回未使用，建议旅客次日再联系售票处办理退票，若旅客客票状态一直未值机状态不能退票，客服人员可记录旅客客票信息再联系值机取消。
去台湾必须出具往返程机票。如回程不直接回长沙，也要出具离开台湾去其他地方的行程单·,送机的无陪儿童家长一般要求留在机场，直到飞机起飞才可以离开。若小孩已过安检，或者已经登机，航班延误时间较长还未起飞，家长担心小孩状况的情况下，可以让家长拨打84797373咨询。如果是南航航班，可以到A岛问询柜台咨询工作人，或者咨询84799333。,1、目前，只实现了湖南省内公民的电子身份证在长沙黄花国际机场过安检，其他省份的会陆续开放。,如果香港旅客想从长沙出港到台湾，无论成人还是小孩都不可以用香港护照，必须用回乡卡（港澳居民来往内地通行证）才能从长沙出境。,4、汽车南站：原汽车南站已搬至新的过度站，新的具体地点：中意路与万芙路交汇处东北角，也可跟旅客描述为万芙路 湘中物流旁。站内机场巴士统一在大厅窗口买票，乘车在负一楼，原联系方式已停用，统一告知0731-84798076。
如果香港旅客想从长沙出港到台湾，无论成人还是小孩都不可以用香港护照，必须用回乡卡（港澳居民来往内地通行证）才能从长沙出境。,1、目前，只实现了湖南省内公民的电子身份证在长沙黄花国际机场过安检，其他省份的会陆续开放。,旅客用台胞证拼音购买机票，登机牌只能是大陆版本拼英，请旅客在办值机的时候与值机说清楚情况请值机在登机牌上盖章，否则安检会阻拦。,4、汽车南站：原汽车南站已搬至新的过度站，新的具体地点：中意路与万芙路交汇处东北角，也可跟旅客描述为万芙路 湘中物流旁。站内机场巴士统一在大厅窗口买票，乘车在负一楼，原联系方式已停用，统一告知0731-84798076。,外国人用护照购买国内航段的机票，护照名字按中国人的习惯姓在前名在后，买票时名在前姓在后，例如：护照是ZHOU MARK，订票时用的MARK  ZHOU，安检值机都没影响，不会影响乘机。
送机的无陪儿童家长一般要求留在机场，直到飞机起飞才可以离开。若小孩已过安检，或者已经登机，航班延误时间较长还未起飞，家长担心小孩状况的情况下，可以让家长拨打84797373咨询。如果是南航航班，可以到A岛问询柜台咨询工作人，或者咨询84799333。,● 机场海关值班电话 15873194756。遇到特殊情况可以拨打此电话，然后回电给旅客。,如有紧急边检相关问题且边检办公电话无法联系，可由我处拨打边检值班手机13808488683再回复旅客。,外国人用护照购买国内航段的机票，护照名字按中国人的习惯姓在前名在后，买票时名在前姓在后，例如：护照是ZHOU MARK，订票时用的MARK  ZHOU，安检值机都没影响，不会影响乘机。,3、旅客来电反映将物品遗失在飞机上，若是刚刚下机，可联系候机寻找。
