2、自助值机柜台只能刷二代身份证办理登机手续，若用其他有效证件购票，须手动输入相应有效证件的号码。自助值机终端无法办理有绑定婴儿旅客的其他旅客的登机牌。,1、不论航班是否正常，自助值机柜台办理值机手续的时间均为航班原计划起飞前的两小时开始办理，起飞前的五十分钟截止办理。,5、办理值机手续时，出示该电子身份证给值机员目测即可,国内值机时间：值机柜台是全开放式，所有旅客可以在航班起飞前3小时开始办理值机手续，起飞前40分钟停止办理。,e.若旅客来电反映自助值机机器没有登机牌了可联系客运更换登机牌。
旅客值机后航班延误需要取消行程办理退票，若旅客还在机场可到原值机柜台退回登机牌，再联系原售票处办理退票，若已经离开机场，可不退回登机牌，旅客客票状态会在飞机起飞后自动变回未使用，建议旅客次日再联系售票处办理退票，若旅客客票状态一直未值机状态不能退票，客服人员可记录旅客客票信息再联系值机取消。,1、不论航班是否正常，自助值机柜台办理值机手续的时间均为航班原计划起飞前的两小时开始办理，起飞前的五十分钟截止办理。,航班延误不论什么原因，目前大部分航司都支持免费退改签，若旅客行程紧急，可建议旅客前往航司相应柜台改签，退票需要联系原售票处，目前大部分航司都支持网上下载航班延误证明。,2、自助值机柜台只能刷二代身份证办理登机手续，若用其他有效证件购票，须手动输入相应有效证件的号码。自助值机终端无法办理有绑定婴儿旅客的其他旅客的登机牌。,护照丢失乘机要求：1、中国人丢失护照到当地公安局补办护照。2、外国人或者港澳同胞乘坐国内航班：丢失护照，到出入境管理局办理遗失证明。3、外国人乘坐国际航班：方式一：去大使馆补办护照；方式二：去当地出入境管理局咨询是否可以办理外国人出入境通行证。4、港澳台同胞乘坐地区航班：到当地出入境管理局办理证件。
旅客用台胞证拼音购买机票，登机牌只能是大陆版本拼英，请旅客在办值机的时候与值机说清楚情况请值机在登机牌上盖章，否则安检会阻拦。,“微信值机” 开放时间与航空公司网上值机时间相同，若旅客反映官网已经可以值机了，但是我们微信不行。微信值机数据会在晚上8点更新，可建议旅客晚上8点以后再试。若还是不行可能是航司并未开放该航班权限。,d.旅客如果订当天的票，有可能出现值机时无机票信息的情况。出现这种情况的原因一般是因为订票信息没有及时从黑屏传送到值机系统的白屏。遇到这种情况，在确认黑屏中机票信息正常之后，可以提供票号给旅客，让值机人员从黑屏导入，或者建议旅客到值机主任柜台办理。,国内值机时间：值机柜台是全开放式，所有旅客可以在航班起飞前3小时开始办理值机手续，起飞前40分钟停止办理。,c.	旅客在机场登机牌遗失，在该航班规定值机时间内可以在机场相应开放的柜台进行补打登机牌，不限在国内值机主任柜台。如果旅客的登机牌为航空公司官网通过网上值机打印，也是同样规定。
*具体事项请在购票时与航空公司联系，并咨询专业医生意见，以确保能够顺利出行。,“微信值机” 开放时间与航空公司网上值机时间相同，若旅客反映官网已经可以值机了，但是我们微信不行。微信值机数据会在晚上8点更新，可建议旅客晚上8点以后再试。若还是不行可能是航司并未开放该航班权限。,d.旅客如果订当天的票，有可能出现值机时无机票信息的情况。出现这种情况的原因一般是因为订票信息没有及时从黑屏传送到值机系统的白屏。遇到这种情况，在确认黑屏中机票信息正常之后，可以提供票号给旅客，让值机人员从黑屏导入，或者建议旅客到值机主任柜台办理。,接种前请您将您的身体状况告知施种人，必要时先做体检。,送机的无陪儿童家长一般要求留在机场，直到飞机起飞才可以离开。若小孩已过安检，或者已经登机，航班延误时间较长还未起飞，家长担心小孩状况的情况下，可以让家长拨打84797373咨询。如果是南航航班，可以到A岛问询柜台咨询工作人，或者咨询84799333。
1、不论航班是否正常，自助值机柜台办理值机手续的时间均为航班原计划起飞前的两小时开始办理，起飞前的五十分钟截止办理。,2、自助值机柜台只能刷二代身份证办理登机手续，若用其他有效证件购票，须手动输入相应有效证件的号码。自助值机终端无法办理有绑定婴儿旅客的其他旅客的登机牌。,5、办理值机手续时，出示该电子身份证给值机员目测即可,国内值机时间：值机柜台是全开放式，所有旅客可以在航班起飞前3小时开始办理值机手续，起飞前40分钟停止办理。,旅客用台胞证拼音购买机票，登机牌只能是大陆版本拼英，请旅客在办值机的时候与值机说清楚情况请值机在登机牌上盖章，否则安检会阻拦。
“微信值机” 开放时间与航空公司网上值机时间相同，若旅客反映官网已经可以值机了，但是我们微信不行。微信值机数据会在晚上8点更新，可建议旅客晚上8点以后再试。若还是不行可能是航司并未开放该航班权限。,3、南航自助值机只要是过了零点就能办理当天的航班，没有起飞时间的限制，但存在部分航班无法自助打印的情况。,c.	旅客在机场登机牌遗失，在该航班规定值机时间内可以在机场相应开放的柜台进行补打登机牌，不限在国内值机主任柜台。如果旅客的登机牌为航空公司官网通过网上值机打印，也是同样规定。,d.旅客如果订当天的票，有可能出现值机时无机票信息的情况。出现这种情况的原因一般是因为订票信息没有及时从黑屏传送到值机系统的白屏。遇到这种情况，在确认黑屏中机票信息正常之后，可以提供票号给旅客，让值机人员从黑屏导入，或者建议旅客到值机主任柜台办理。,旅客用台胞证拼音购买机票，登机牌只能是大陆版本拼英，请旅客在办值机的时候与值机说清楚情况请值机在登机牌上盖章，否则安检会阻拦。
如果旅客要求取消值机，一般情况下旅客值机在哪办理就在哪取消。若旅客人在机场可提供乘机人身份证原件和登机牌到机场开放的值机柜台取消值机，若旅客已经离开机场，可告知旅客正常情况下24小时候会自动取消登机状态，若超过24小时仍未取消可记录旅客姓名证件号码以及航班信息由坐席员联系值机取消。,旅客值机后航班延误需要取消行程办理退票，若旅客还在机场可到原值机柜台退回登机牌，再联系原售票处办理退票，若已经离开机场，可不退回登机牌，旅客客票状态会在飞机起飞后自动变回未使用，建议旅客次日再联系售票处办理退票，若旅客客票状态一直未值机状态不能退票，客服人员可记录旅客客票信息再联系值机取消。,旅客用台胞证拼音购买机票，登机牌只能是大陆版本拼英，请旅客在办值机的时候与值机说清楚情况请值机在登机牌上盖章，否则安检会阻拦。,c.	旅客在机场登机牌遗失，在该航班规定值机时间内可以在机场相应开放的柜台进行补打登机牌，不限在国内值机主任柜台。如果旅客的登机牌为航空公司官网通过网上值机打印，也是同样规定。,国内值机时间：值机柜台是全开放式，所有旅客可以在航班起飞前3小时开始办理值机手续，起飞前40分钟停止办理。
“微信值机” 开放时间与航空公司网上值机时间相同，若旅客反映官网已经可以值机了，但是我们微信不行。微信值机数据会在晚上8点更新，可建议旅客晚上8点以后再试。若还是不行可能是航司并未开放该航班权限。,d.旅客如果订当天的票，有可能出现值机时无机票信息的情况。出现这种情况的原因一般是因为订票信息没有及时从黑屏传送到值机系统的白屏。遇到这种情况，在确认黑屏中机票信息正常之后，可以提供票号给旅客，让值机人员从黑屏导入，或者建议旅客到值机主任柜台办理。,3、南航自助值机只要是过了零点就能办理当天的航班，没有起飞时间的限制，但存在部分航班无法自助打印的情况。,c.	旅客在机场登机牌遗失，在该航班规定值机时间内可以在机场相应开放的柜台进行补打登机牌，不限在国内值机主任柜台。如果旅客的登机牌为航空公司官网通过网上值机打印，也是同样规定。,国内值机时间：值机柜台是全开放式，所有旅客可以在航班起飞前3小时开始办理值机手续，起飞前40分钟停止办理。
c.	旅客在机场登机牌遗失，在该航班规定值机时间内可以在机场相应开放的柜台进行补打登机牌，不限在国内值机主任柜台。如果旅客的登机牌为航空公司官网通过网上值机打印，也是同样规定。,旅客用台胞证拼音购买机票，登机牌只能是大陆版本拼英，请旅客在办值机的时候与值机说清楚情况请值机在登机牌上盖章，否则安检会阻拦。,如果旅客要求取消值机，一般情况下旅客值机在哪办理就在哪取消。若旅客人在机场可提供乘机人身份证原件和登机牌到机场开放的值机柜台取消值机，若旅客已经离开机场，可告知旅客正常情况下24小时候会自动取消登机状态，若超过24小时仍未取消可记录旅客姓名证件号码以及航班信息由坐席员联系值机取消。,d.旅客如果订当天的票，有可能出现值机时无机票信息的情况。出现这种情况的原因一般是因为订票信息没有及时从黑屏传送到值机系统的白屏。遇到这种情况，在确认黑屏中机票信息正常之后，可以提供票号给旅客，让值机人员从黑屏导入，或者建议旅客到值机主任柜台办理。,1、不论航班是否正常，自助值机柜台办理值机手续的时间均为航班原计划起飞前的两小时开始办理，起飞前的五十分钟截止办理。
2、自助值机柜台只能刷二代身份证办理登机手续，若用其他有效证件购票，须手动输入相应有效证件的号码。自助值机终端无法办理有绑定婴儿旅客的其他旅客的登机牌。,5、办理值机手续时，出示该电子身份证给值机员目测即可,1、不论航班是否正常，自助值机柜台办理值机手续的时间均为航班原计划起飞前的两小时开始办理，起飞前的五十分钟截止办理。,旅客用台胞证拼音购买机票，登机牌只能是大陆版本拼英，请旅客在办值机的时候与值机说清楚情况请值机在登机牌上盖章，否则安检会阻拦。,凭有效中国护照和新加坡签证，或具有签证效力的证件办理边检手续。
旅客用台胞证拼音购买机票，登机牌只能是大陆版本拼英，请旅客在办值机的时候与值机说清楚情况请值机在登机牌上盖章，否则安检会阻拦。,外国人用护照购买国内航段的机票，护照名字按中国人的习惯姓在前名在后，买票时名在前姓在后，例如：护照是ZHOU MARK，订票时用的MARK  ZHOU，安检值机都没影响，不会影响乘机。,国内航班，未孵化的虫卵，绝对不允许带入客舱，也不建议托运，最好先咨询承运人征得同意之后走货运。如果是标本，也建议打包好了之后托运，但也要经过安检现场检测后才可放行。,不要着急，这一点民航局显然也考虑到了：,《规定》不仅明确了超过“15分钟”就算是延误，还明确了什么是“离港”，什么算是“到港”，飞机在机场滑行也算时间。
1、航班起飞前40分钟开始登机，航班起飞前15分钟停止登机，开始登机时机场中央大广播会自动播放登机广播，主要是催促已经办理值机手续但还未过安检的旅客尽快过安检，开始登机后登机口也会有相应区域广播，主要是航班动态、登机口变更以及催促旅客登机广播，该广播覆盖范围有限，若旅客离开登机口则有可能听不到。若旅客来电质疑没有听到广播通知，中央大广播记录可联系广播室查询，登机口区域广播可联系候机查询，但广播录音均不可对外。,2、旅客质疑登机口无工作人员，可告知旅客候机工作人员工作地点并不固定，可能目前还在其他登机口办理旅客登机服务，等旅客的航班快到登机时间工作人员会提前过来。若已经到登机时间还无工作人员可联系候机室确认。,以往，无论是天气状况、空中交通管制，还是机场和航空公司方面的原因，面对航班延误或取消，旅客听到的往往是航空公司或者机场单方面给出的理由，至于是不是和实际情况相符合，旅客通常也无从知晓。,航班延误分为临时延误以及计划性延误，临时延误的航班一般由机械故障、流量控制、天气原因等不可控因素引起，航班变动信息由机场临时通知，建议旅客按原计划时间到机场办理乘机手续，旅客在现场可通过关注机场广播以及航显屏了解航班最新动态。计划性延误一般由航司原因引起，如销售政策，航线调整等，航司会提前发布延误信息，旅客可按照航司更新后的信息办理乘机手续。,如果旅客要求取消值机，一般情况下旅客值机在哪办理就在哪取消。若旅客人在机场可提供乘机人身份证原件和登机牌到机场开放的值机柜台取消值机，若旅客已经离开机场，可告知旅客正常情况下24小时候会自动取消登机状态，若超过24小时仍未取消可记录旅客姓名证件号码以及航班信息由坐席员联系值机取消。
国内值机时间：值机柜台是全开放式，所有旅客可以在航班起飞前3小时开始办理值机手续，起飞前40分钟停止办理。,1、航班起飞前40分钟开始登机，航班起飞前15分钟停止登机，开始登机时机场中央大广播会自动播放登机广播，主要是催促已经办理值机手续但还未过安检的旅客尽快过安检，开始登机后登机口也会有相应区域广播，主要是航班动态、登机口变更以及催促旅客登机广播，该广播覆盖范围有限，若旅客离开登机口则有可能听不到。若旅客来电质疑没有听到广播通知，中央大广播记录可联系广播室查询，登机口区域广播可联系候机查询，但广播录音均不可对外。,国际航班值机：柜台是分不同的航空公司开放，200坐以下的飞机起飞前2小时开始办理值机手续，200以上提前3小时开始办理值机手续，提前40分钟结束办理，亚航国际航班提前一小时截止办理登机牌。,航班飞机关舱门后至起飞前，或者降落后至开舱门前，旅客在航空器内等待，超过机场规定的地面滑行时间，就算是“机上延误”。,1、不论航班是否正常，自助值机柜台办理值机手续的时间均为航班原计划起飞前的两小时开始办理，起飞前的五十分钟截止办理。
国内值机时间：值机柜台是全开放式，所有旅客可以在航班起飞前3小时开始办理值机手续，起飞前40分钟停止办理。,1、航班起飞前40分钟开始登机，航班起飞前15分钟停止登机，开始登机时机场中央大广播会自动播放登机广播，主要是催促已经办理值机手续但还未过安检的旅客尽快过安检，开始登机后登机口也会有相应区域广播，主要是航班动态、登机口变更以及催促旅客登机广播，该广播覆盖范围有限，若旅客离开登机口则有可能听不到。若旅客来电质疑没有听到广播通知，中央大广播记录可联系广播室查询，登机口区域广播可联系候机查询，但广播录音均不可对外。,1、不论航班是否正常，自助值机柜台办理值机手续的时间均为航班原计划起飞前的两小时开始办理，起飞前的五十分钟截止办理。,如果旅客要求取消值机，一般情况下旅客值机在哪办理就在哪取消。若旅客人在机场可提供乘机人身份证原件和登机牌到机场开放的值机柜台取消值机，若旅客已经离开机场，可告知旅客正常情况下24小时候会自动取消登机状态，若超过24小时仍未取消可记录旅客姓名证件号码以及航班信息由坐席员联系值机取消。,国际航班值机：柜台是分不同的航空公司开放，200坐以下的飞机起飞前2小时开始办理值机手续，200以上提前3小时开始办理值机手续，提前40分钟结束办理，亚航国际航班提前一小时截止办理登机牌。
59.枪状的电钻不超过托运行李的尺寸可以托运。,国内航班树苗生长液只要是安全的均可办理行李托运，没有量的限制，但是超过免费行李额部分要收取逾重行李费用。,ー、禁止随身携带但可以作为行李托运的物品,二、随身携带或者作为行李托运有限定条件的物品,如果旅客需要办理宠物托运（跟航班走）必须要有由正规的检验检疫单位开具的动物检疫证明与消毒证明（一般宠物医院开具的无效），旅客如果有湖南省宠物免疫证也是无法办理宠物托运的。建议旅客先要咨询好办证点是否是正规单位，最后就是购票同时向航司确认，乘坐的航班是否是有氧舱，航司是否同意办理宠物托运。
国内航班树苗生长液只要是安全的均可办理行李托运，没有量的限制，但是超过免费行李额部分要收取逾重行李费用。,b. 超大超限行李尺寸标准，宽*高不能超过1m*1m，长度只要可以放上传送带即可。是否需要收费建议咨询航司，由航司工作人员现场收取。不建议告知旅客有超大超限行李通道。超大超限的安检上下班的时间是随航班走。,进港行李提取手续（超重行李费用自理）；,海航飞伦敦的国际航班逾重行李费由国内逾重行李柜台代收，一般国际航班的逾重行李费由代办现场收取,d.海航飞伦敦的国际航班逾重行李费由国内逾重行李柜台代收，一般国际航班的逾重行李费由代办现场收取.
旅客的托运行李全部或部分损坏、遗失，赔偿金额每公斤不超过RMB100元。如行李的价值每公斤低于RMB100元时，按实际价值赔偿。,59.枪状的电钻不超过托运行李的尺寸可以托运。,国内航班树苗生长液只要是安全的均可办理行李托运，没有量的限制，但是超过免费行李额部分要收取逾重行李费用。,81.电脑主机和显示屏必须托运、电视机（小型）可以托运，超过托运行李的部分收取逾重费；,每位旅客的丢失行李最多按该旅客享受的免费行李额赔偿。
国内航班树苗生长液只要是安全的均可办理行李托运，没有量的限制，但是超过免费行李额部分要收取逾重行李费用。,"c. 逾重行李费现场只能开收据，如旅客要发票可联系航空公司或在柜台提出要求，柜台会去财务开具，需要几天时间再给旅客邮寄，邮费到付, 国内收逾重行李收费柜台电话89981788（非南航）。",海航飞伦敦的国际航班逾重行李费由国内逾重行李柜台代收，一般国际航班的逾重行李费由代办现场收取,d.海航飞伦敦的国际航班逾重行李费由国内逾重行李柜台代收，一般国际航班的逾重行李费由代办现场收取.,若旅客想取消行程但已经办理值机且有行李托运，需要联系原值机柜台或主任值机柜台取消值机并取出行李，并与值机工作人员先行确认已托运行李将会从超大超限行李口还是行李转盘处提取。
旅客托运行李未随机到达，若是落地长沙的航班可记录行李单号及航班号至行李查询处查询。,旅客托运行李内部分物品丢失：目的地为长沙的航班，旅客未出机场隔离区可以建议旅客跟行李查询室联系，离开机场建议旅客联系公安机关报案处理；长沙始发的航班建议旅客联系到达机场。,若旅客想取消行程但已经办理值机且有行李托运，需要联系原值机柜台或主任值机柜台取消值机并取出行李，并与值机工作人员先行确认已托运行李将会从超大超限行李口还是行李转盘处提取。,从长沙机场出发的国际航班，只要旅客已经向航司成功申请了行李加重，在办理值机的时候就可以享受已经加重后的托运行李额。,宠物托运流程，小宠物狗托运时，旅客在航空公司办好相关申请手续后，可以提前到机场值机柜台办理托运手续，大型狗需要走货物托运，如无法判断宠物的大小，建议旅客提前与航空公司联系，或提前到机场咨询现场工作人员；
包装不符合要求的行李；,如果货物的包装不符合规定，应要求托运人改进或重新包装。,托运行李必须包装完善、锁扣完好、捆扎牢固，能承受一定的压力，能够在正常的操作条件下安全装卸和运输；旅行箱、旅行袋和手提包等必须加锁；两件以上的包件，不能捆为一件；行李上不能附插其他物品；竹篮、网兜、草绳、草袋等不能作为行李的外包装物；行李上应写明旅客的姓名、详细地址、电话号码；行李包装内不能用锯末、谷壳、草屑等作衬垫物。,2.油的携带：原厂原包装符合包装要求下可以办理行李托运，暂无数量限制，建议少带。食用油无论是否原厂原包装均不可货运。有特殊用途的散装的食用油，如参展、科研等，如果能够出具权威的成分证明或生产许可证，征得承运人同意，经检查确认其安全性之后可以进行托运。,除纸袋包装的文件、资料类货物外，所有的货物包装外都应使用符合规定的包装带捆扎。捆扎货物的包装带必须能够承受本件货物的全部重量，保证货物在运输过程中不会散开。
ー、禁止随身携带但可以作为行李托运的物品,（一）随身携带有限定条件但可以作为行李托运的物品,14. 关于电蚊片与电蚊器运输规定：电蚊片和液态的药水都不能携带和托运，但是使用的电器可以携带和托运，电蚊拍可限量（每人一个）作手提行李携带，无防启动装置的电蚊拍不能作托运行李携带。,国内航班树苗生长液只要是安全的均可办理行李托运，没有量的限制，但是超过免费行李额部分要收取逾重行李费用。,93.国内航班不超过行李尺寸的植物可以带上飞机，也可以进行托运，有根茎或者土壤的也可以。
（待确认）美国、加拿大航线的旅客托运行李是计件收费，经济舱旅客每人可免费托运2件，每件不超23KG，公务舱旅客每人可免费托运2件，每件不超过32KG；,国际航班其他航线免费行李额与国内航班相同，免费托运20KG，不限件数；,d.海航飞伦敦的国际航班逾重行李费由国内逾重行李柜台代收，一般国际航班的逾重行李费由代办现场收取.,海航飞伦敦的国际航班逾重行李费由国内逾重行李柜台代收，一般国际航班的逾重行李费由代办现场收取,国内航班树苗生长液只要是安全的均可办理行李托运，没有量的限制，但是超过免费行李额部分要收取逾重行李费用。
涉及飞机安全管制的，如饮料、水、电池及其他金属物品等，应咨询机场安检部门。涉及海关管理的，还有疑惑，机场海关旅检科电话8499887，84798686.,旅客帮乘机人代取寄存在安检的物品，如果旅客没有乘机人的身份证，寄存单遗失。如果旅客可以提供乘机人乘机日期，航班号码，物品名称和数量，及旅客的身份证，安检工作人员可以找到该物品，旅客可以领取到该寄存物品,种子、苗木及其它繁殖材料、烟叶、粮谷、豆类（入境前须事先办理检疫审批手续）；,乘坐飞机前的安检环节可能曾给很多旅客带来过困扰，尤其是在旅客身体有残疾或者携带贵重物品的情况下。因为通常情况下，安检场所是公开场所，这就意味着旅客的个人隐私可能无法得道妥善的保护。,1、活动物（犬、猫除外），包括所有的哺乳动物、鸟类、鱼类、两栖类、爬行类、昆虫类和其他无脊椎动物，动物遗传物质。
